ENTRY_TYPE;GUID;LOCALE;ENTRY_NAME;PARENT_ENTRY_ID;FIELD1;FIELD2;FIELD3;FIELD4;FIELD5;FIELD6;ACTIVITY;ACTIVE;EDITABLE
LearningActivity;9162;pt_BR;ReconheÃƒÂ§a um empregado para a equipe. Tire um tempo para conhecer os membros de sua equipe. O agradecimento e reconhecimento dos funcionÃƒÂ¡rios mais experientes sÃƒÂ£o grandes motivadores. Mostre a equipe que vocÃƒÂª observa e aprecia este tipo de trabalho.;9001;ReconheÃƒÂ§a um empregado para a equipe. Tire um tempo para conhecer os membros de sua equipe. O agradecimento e reconhecimento dos funcionÃƒÂ¡rios mais experientes sÃƒÂ£o grandes motivadores. Mostre a equipe que vocÃƒÂª observa e aprecia este tipo de trabalho.;;;;;;ACT;1;1
LearningActivity;9174;pt_BR;Seja um ouvinte ativo. Mostre interesse nas opiniÃƒÂµes dos outros, mesmo que vocÃƒÂª nÃƒÂ£o concorde com eles. Mostre ÃƒÂ s pessoas que vocÃƒÂª estÃƒÂ¡ ouvindo, referindo-se a um ponto especÃƒÂ­fico que eles fizeram.;9001;Seja um ouvinte ativo. Mostre interesse nas opiniÃƒÂµes dos outros, mesmo que vocÃƒÂª nÃƒÂ£o concorde com eles. Mostre ÃƒÂ s pessoas que vocÃƒÂª estÃƒÂ¡ ouvindo, referindo-se a um ponto especÃƒÂ­fico que eles fizeram.;;;;;;ACT;1;1
LearningActivity;9256;pt_BR;"FaÃƒÂ§a uma leitura dinÃƒÂ¢mica primeiro, leia mais tarde. Adquira o hÃƒÂ¡bito de ""passar o olho"" pela papelada, logo que vocÃƒÂª recebÃƒÂª-la. Coloque os itens mais importantes em um arquivo de ""leitura obrigatÃƒÂ³ria"" que vocÃƒÂª vai voltar a ler em um prazo determinado. Arquive as peÃƒÂ§as ÃƒÂºteis, mas menos urgentes para ler mais tarde. E recicle os papÃƒÂ©is que vocÃƒÂª nÃƒÂ£o irÃƒÂ¡ usar.";9001;"FaÃƒÂ§a uma leitura dinÃƒÂ¢mica primeiro, leia mais tarde. Adquira o hÃƒÂ¡bito de ""passar o olho"" pela papelada, logo que vocÃƒÂª recebÃƒÂª-la. Coloque os itens mais importantes em um arquivo de ""leitura obrigatÃƒÂ³ria"" que vocÃƒÂª vai voltar a ler em um prazo determinado. Arquive as peÃƒÂ§as ÃƒÂºteis, mas menos urgentes para ler mais tarde. E recicle os papÃƒÂ©is que vocÃƒÂª nÃƒÂ£o irÃƒÂ¡ usar.";;;;;;ACT;1;1
LearningActivity;9124;pt_BR;Procure maneiras de usar suas habilidades mais valiosas. Voluntarie-se para missÃƒÂµes especiais onde vocÃƒÂª pode usar as habilidades que vocÃƒÂª, e outras pessoas, identificam como sendo o seu melhor.;9001;Procure maneiras de usar suas habilidades mais valiosas. Voluntarie-se para missÃƒÂµes especiais onde vocÃƒÂª pode usar as habilidades que vocÃƒÂª, e outras pessoas, identificam como sendo o seu melhor.;;;;;;ACT;1;1
LearningActivity;9195;pt_BR;Envolva a equipe. Trabalhe prÃƒÂ³ximo a sua equipe para desenvolver e manter uma visÃƒÂ£o alinhada com os objetivos da organizaÃƒÂ§ÃƒÂ£o. PeÃƒÂ§a-lhes para responder ÃƒÂ s seguintes perguntas: Qual ÃƒÂ© o nosso negÃƒÂ³cio? Quem sÃƒÂ£o nossos clientes, e como ÃƒÂ© o nosso atendimento? Como ÃƒÂ© que o trabalho de nossa equipe contribuir para a organizaÃƒÂ§ÃƒÂ£o?;9001;Envolva a equipe. Trabalhe prÃƒÂ³ximo a sua equipe para desenvolver e manter uma visÃƒÂ£o alinhada com os objetivos da organizaÃƒÂ§ÃƒÂ£o. PeÃƒÂ§a-lhes para responder ÃƒÂ s seguintes perguntas: Qual ÃƒÂ© o nosso negÃƒÂ³cio? Quem sÃƒÂ£o nossos clientes, e como ÃƒÂ© o nosso atendimento? Como ÃƒÂ© que o trabalho de nossa equipe contribuir para a organizaÃƒÂ§ÃƒÂ£o?;;;;;;ACT;1;1
LearningActivity;9228;pt_BR;Defina os problemas e os objetivos. Pergunte a si mesmo como um projeto contribuirÃƒÂ¡ para grupo e para as metas organizacionais. Avalie para um ou dois principais benefÃƒÂ­cios do projeto qual serÃƒÂ¡ o retorno para a organizaÃƒÂ§ÃƒÂ£o.;9001;Defina os problemas e os objetivos. Pergunte a si mesmo como um projeto contribuirÃƒÂ¡ para grupo e para as metas organizacionais. Avalie para um ou dois principais benefÃƒÂ­cios do projeto qual serÃƒÂ¡ o retorno para a organizaÃƒÂ§ÃƒÂ£o.;;;;;;ACT;1;1
LearningActivity;9057;pt_BR;Mire alto, mas ajude seus funcionÃƒÂ¡rios atingirem o alvo. Quando vocÃƒÂª definir metas exigentes, permita que os funcionÃƒÂ¡rios saibam que vocÃƒÂª quer que eles tenham sucesso, e que vocÃƒÂª vai oferecer os recursos e o apoio necessÃƒÂ¡rios.;9001;Mire alto, mas ajude seus funcionÃƒÂ¡rios atingirem o alvo. Quando vocÃƒÂª definir metas exigentes, permita que os funcionÃƒÂ¡rios saibam que vocÃƒÂª quer que eles tenham sucesso, e que vocÃƒÂª vai oferecer os recursos e o apoio necessÃƒÂ¡rios.;;;;;;ACT;1;1
LearningActivity;9045;pt_BR;Deixe a equipe fazer ajustes. Uma vez que a equipe entende os objetivos do projeto e os prazos, dÃƒÂª-lhes a liberdade de ajustar e dividir funÃƒÂ§ÃƒÂµes. Certifique-se de que todos os membros do projeto estÃƒÂ£o envolvidos e informados quando isso acontece.;9001;Deixe a equipe fazer ajustes. Uma vez que a equipe entende os objetivos do projeto e os prazos, dÃƒÂª-lhes a liberdade de ajustar e dividir funÃƒÂ§ÃƒÂµes. Certifique-se de que todos os membros do projeto estÃƒÂ£o envolvidos e informados quando isso acontece.;;;;;;ACT;1;1
LearningActivity;9060;pt_BR;Aplique o que vocÃƒÂª aprendeu. Desenvolva um plano para aplicar um novo conhecimento. Compartilhe o que vocÃƒÂª aprendeu, e demonstre resultados para que o seu gerente possa promove-lo ou incentiva-lo.;9001;Aplique o que vocÃƒÂª aprendeu. Desenvolva um plano para aplicar um novo conhecimento. Compartilhe o que vocÃƒÂª aprendeu, e demonstre resultados para que o seu gerente possa promove-lo ou incentiva-lo.;;;;;;ACT;1;1
LearningActivity;9246;pt_BR;Organize para que outros possam encontrar informaÃƒÂ§ÃƒÂµes. Rotule e armazene informaÃƒÂ§ÃƒÂµes para que outros possam chegar a elas sem lhe perguntar.;9001;Organize para que outros possam encontrar informaÃƒÂ§ÃƒÂµes. Rotule e armazene informaÃƒÂ§ÃƒÂµes para que outros possam chegar a elas sem lhe perguntar.;;;;;;ACT;1;1
LearningActivity;9096;pt_BR;ReÃƒÂºna informaÃƒÂ§ÃƒÂµes sobre seus concorrentes. Converse com seus clientes sobre seus concorrentes, seus pontos de venda, polÃƒÂ­ticas e procedimentos. Pergunte a eles o que eles gostam ou nÃƒÂ£o gostam sobre os produtos deles. Registre suas descobertas em seu resumo do produto.;9001;ReÃƒÂºna informaÃƒÂ§ÃƒÂµes sobre seus concorrentes. Converse com seus clientes sobre seus concorrentes, seus pontos de venda, polÃƒÂ­ticas e procedimentos. Pergunte a eles o que eles gostam ou nÃƒÂ£o gostam sobre os produtos deles. Registre suas descobertas em seu resumo do produto.;;;;;;ACT;1;1
LearningActivity;9114;pt_BR;Saiba mais sobre o cliente do seu cliente. Trabalhe com seu cliente quando ele estiver lidando com seu prÃƒÂ³prio cliente. Pense em como seus produtos / serviÃƒÂ§os podem contribuir para estes clientes, e anote duas necessidades especÃƒÂ­ficas que vocÃƒÂª aprendeu sobre o que pode ser usado como um ponto de venda.;9001;Saiba mais sobre o cliente do seu cliente. Trabalhe com seu cliente quando ele estiver lidando com seu prÃƒÂ³prio cliente. Pense em como seus produtos / serviÃƒÂ§os podem contribuir para estes clientes, e anote duas necessidades especÃƒÂ­ficas que vocÃƒÂª aprendeu sobre o que pode ser usado como um ponto de venda.;;;;;;ACT;1;1
LearningActivity;9137;pt_BR;DÃƒÂª tempo para as experiÃƒÂªncias de autodesenvolvimento. Esteja preparado para deixar tempo para seus empregados reunirem-se com outras empresas e fazer treinamentos em horÃƒÂ¡rio de trabalho.;9001;DÃƒÂª tempo para as experiÃƒÂªncias de autodesenvolvimento. Esteja preparado para deixar tempo para seus empregados reunirem-se com outras empresas e fazer treinamentos em horÃƒÂ¡rio de trabalho.;;;;;;ACT;1;1
LearningActivity;9245;pt_BR;Organize e processe informaÃƒÂ§ÃƒÂµes. Aproveite o tempo para organizar e processar informaÃƒÂ§ÃƒÂµes positivas e negativas antes de passar para os outros. Preveja como eles vÃƒÂ£o usar a informaÃƒÂ§ÃƒÂ£o e coloque-a de uma forma ÃƒÂºtil. Quando for o caso, dÃƒÂª aos outros um resumo que direcione sua atenÃƒÂ§ÃƒÂ£o para os aspectos mais relevantes da informaÃƒÂ§ÃƒÂ£o.;9001;Organize e processe informaÃƒÂ§ÃƒÂµes. Aproveite o tempo para organizar e processar informaÃƒÂ§ÃƒÂµes positivas e negativas antes de passar para os outros. Preveja como eles vÃƒÂ£o usar a informaÃƒÂ§ÃƒÂ£o e coloque-a de uma forma ÃƒÂºtil. Quando for o caso, dÃƒÂª aos outros um resumo que direcione sua atenÃƒÂ§ÃƒÂ£o para os aspectos mais relevantes da informaÃƒÂ§ÃƒÂ£o.;;;;;;ACT;1;1
LearningActivity;9019;pt_BR;Aprendizagem com os outros. Uma das melhores maneiras de aprender ÃƒÂ© atravÃƒÂ©s de outras pessoas. Pense nas pessoas em sua organizaÃƒÂ§ÃƒÂ£o e identifique as habilidades ÃƒÂºnicas de cada um. Compare-os com os seus objetivos de desenvolvimento, e entre em contato com aquelas que mais poderÃƒÂ£o te ajudar. Organize-se para ajudÃƒÂ¡-los em um projeto que iria expÃƒÂ´-lo com as habilidades que vocÃƒÂª quer aprender.;9001;Aprendizagem com os outros. Uma das melhores maneiras de aprender ÃƒÂ© atravÃƒÂ©s de outras pessoas. Pense nas pessoas em sua organizaÃƒÂ§ÃƒÂ£o e identifique as habilidades ÃƒÂºnicas de cada um. Compare-os com os seus objetivos de desenvolvimento, e entre em contato com aquelas que mais poderÃƒÂ£o te ajudar. Organize-se para ajudÃƒÂ¡-los em um projeto que iria expÃƒÂ´-lo com as habilidades que vocÃƒÂª quer aprender.;;;;;;ACT;1;1
LearningActivity;9234;pt_BR;Obter a entrada mais direta. VÃƒÂ¡ diretamente para a pessoa mais prÃƒÂ³xima a questÃƒÂ£o, se essa pessoa ÃƒÂ© um gerente em outro departamento, um representante de serviÃƒÂ§o ao cliente, ou um cliente. NÃƒÂ£o aceite opiniÃƒÂµes de segunda mÃƒÂ£o quando os contatos diretos estÃƒÂ£o disponÃƒÂ­veis.;9001;Obter a entrada mais direta. VÃƒÂ¡ diretamente para a pessoa mais prÃƒÂ³xima a questÃƒÂ£o, se essa pessoa ÃƒÂ© um gerente em outro departamento, um representante de serviÃƒÂ§o ao cliente, ou um cliente. NÃƒÂ£o aceite opiniÃƒÂµes de segunda mÃƒÂ£o quando os contatos diretos estÃƒÂ£o disponÃƒÂ­veis.;;;;;;ACT;1;1
LearningActivity;9048;pt_BR;Melhores habilidades organizacionais para sua equipe. Em uma reuniÃƒÂ£o, peÃƒÂ§a a todos os seus participantes para fazer seus registros e revise-os depois, ÃƒÂ© um exercÃƒÂ­cio de treinamento para manutenÃƒÂ§ÃƒÂ£o de registros.;9001;Melhores habilidades organizacionais para sua equipe. Em uma reuniÃƒÂ£o, peÃƒÂ§a a todos os seus participantes para fazer seus registros e revise-os depois, ÃƒÂ© um exercÃƒÂ­cio de treinamento para manutenÃƒÂ§ÃƒÂ£o de registros.;;;;;;ACT;1;1
LearningActivity;9017;pt_BR;Perspectiva ampla. NÃƒÂ£o estreite suas opÃƒÂ§ÃƒÂµes atÃƒÂ© que vocÃƒÂª tenha esgotado as possibilidades. VocÃƒÂª jÃƒÂ¡ obteve todas as informaÃƒÂ§ÃƒÂµes necessÃƒÂ¡rias das diferentes partes? VocÃƒÂª jÃƒÂ¡ fez questÃƒÂ£o de incluir as opiniÃƒÂµes das pessoas que vocÃƒÂª geralmente concorda ou discorda?;9001;Perspectiva ampla. NÃƒÂ£o estreite suas opÃƒÂ§ÃƒÂµes atÃƒÂ© que vocÃƒÂª tenha esgotado as possibilidades. VocÃƒÂª jÃƒÂ¡ obteve todas as informaÃƒÂ§ÃƒÂµes necessÃƒÂ¡rias das diferentes partes? VocÃƒÂª jÃƒÂ¡ fez questÃƒÂ£o de incluir as opiniÃƒÂµes das pessoas que vocÃƒÂª geralmente concorda ou discorda?;;;;;;ACT;1;1
LearningActivity;9031;pt_BR;Pergunte sobre interesses. Mantenha contato com os funcionÃƒÂ¡rios sobre os seus interesses. Use essas informaÃƒÂ§ÃƒÂµes para estabelecer metas e identificar tarefas desafiadoras que o empregado provavelmente se motivarÃƒÂ¡ para concluir.;9001;Pergunte sobre interesses. Mantenha contato com os funcionÃƒÂ¡rios sobre os seus interesses. Use essas informaÃƒÂ§ÃƒÂµes para estabelecer metas e identificar tarefas desafiadoras que o empregado provavelmente se motivarÃƒÂ¡ para concluir.;;;;;;ACT;1;1
LearningActivity;9080;pt_BR;AnÃƒÂ¡lise completa da indÃƒÂºstria. Siga um formato de anÃƒÂ¡lise da indÃƒÂºstria (disponÃƒÂ­vel em qualquer livro padrÃƒÂ£o de estratÃƒÂ©gia corporativa) e avalie sua indÃƒÂºstria.;9001;AnÃƒÂ¡lise completa da indÃƒÂºstria. Siga um formato de anÃƒÂ¡lise da indÃƒÂºstria (disponÃƒÂ­vel em qualquer livro padrÃƒÂ£o de estratÃƒÂ©gia corporativa) e avalie sua indÃƒÂºstria.;;;;;;ACT;1;1
LearningActivity;9121;pt_BR;Olhe para as causas. Tente determinar se existem causas para o comportamento de um determinado funcionÃƒÂ¡rio, tais como a falta de competÃƒÂªncias, a falta de conhecimento do produto, questÃƒÂµes pessoais temporÃƒÂ¡rias, etc. Avalie se os problemas podem ser corrigidos. SerÃƒÂ¡ que ele tem as habilidades para o trabalho? Ele estÃƒÂ¡ no lugar certo?;9001;Olhe para as causas. Tente determinar se existem causas para o comportamento de um determinado funcionÃƒÂ¡rio, tais como a falta de competÃƒÂªncias, a falta de conhecimento do produto, questÃƒÂµes pessoais temporÃƒÂ¡rias, etc. Avalie se os problemas podem ser corrigidos. SerÃƒÂ¡ que ele tem as habilidades para o trabalho? Ele estÃƒÂ¡ no lugar certo?;;;;;;ACT;1;1
LearningActivity;9182;pt_BR;Desenvolva uma visÃƒÂ£o comum. Desenvolva e comunique uma visÃƒÂ£o comum para o seu time. Certifique-se de que todos entenderam o papel do grupo na organizaÃƒÂ§ÃƒÂ£o e como o grupo deve interagir e cooperar com outros grupos.;9001;Desenvolva uma visÃƒÂ£o comum. Desenvolva e comunique uma visÃƒÂ£o comum para o seu time. Certifique-se de que todos entenderam o papel do grupo na organizaÃƒÂ§ÃƒÂ£o e como o grupo deve interagir e cooperar com outros grupos.;;;;;;ACT;1;1
LearningActivity;9188;pt_BR;Promova uma comunicaÃƒÂ§ÃƒÂ£o aberta. Incentive as pessoas a expor as opiniÃƒÂµes aberta e diretamente, e ofereÃƒÂ§a treinamento para os indivÃƒÂ­duos que sÃƒÂ£o insensÃƒÂ­veis ao criticar as ideias dos outros.;9001;Promova uma comunicaÃƒÂ§ÃƒÂ£o aberta. Incentive as pessoas a expor as opiniÃƒÂµes aberta e diretamente, e ofereÃƒÂ§a treinamento para os indivÃƒÂ­duos que sÃƒÂ£o insensÃƒÂ­veis ao criticar as ideias dos outros.;;;;;;ACT;1;1
LearningActivity;9186;pt_BR;Explique o valor de cada mudanÃƒÂ§a. Certifique-se de permitir que os funcionÃƒÂ¡rios saibam por que as prioridades estÃƒÂ£o mudando, e que, os benefÃƒÂ­cios da nova direÃƒÂ§ÃƒÂ£o serÃƒÂ¡ para a equipe e para cada um. Mostre exatamente como novas tarefas e responsabilidades contribuirÃƒÂ£o para o plano global da organizaÃƒÂ§ÃƒÂ£o.;9001;Explique o valor de cada mudanÃƒÂ§a. Certifique-se de permitir que os funcionÃƒÂ¡rios saibam por que as prioridades estÃƒÂ£o mudando, e que, os benefÃƒÂ­cios da nova direÃƒÂ§ÃƒÂ£o serÃƒÂ¡ para a equipe e para cada um. Mostre exatamente como novas tarefas e responsabilidades contribuirÃƒÂ£o para o plano global da organizaÃƒÂ§ÃƒÂ£o.;;;;;;ACT;1;1
LearningActivity;9175;pt_BR;Esteja aberto a sugestÃƒÂµes. Mantenha a mente aberta para sugestÃƒÂµes dos empregados que procuram melhorias na qualidade. Incentive ideias de todos os empregados, sem se importar com o seu tÃƒÂ­tulo ou experiÃƒÂªncia.;9001;Esteja aberto a sugestÃƒÂµes. Mantenha a mente aberta para sugestÃƒÂµes dos empregados que procuram melhorias na qualidade. Incentive ideias de todos os empregados, sem se importar com o seu tÃƒÂ­tulo ou experiÃƒÂªncia.;;;;;;ACT;1;1
LearningActivity;9140;pt_BR;Separe um tempo para uma verificaÃƒÂ§ÃƒÂ£o final de qualidade. EstabeleÃƒÂ§a prazos para  verificaÃƒÂ§ÃƒÂ£o da qualidade. AlÃƒÂ©m disso, divida as tarefas em partes com prazos distintos para que vocÃƒÂª evite uma crise de ÃƒÂºltima hora.;9001;Separe um tempo para uma verificaÃƒÂ§ÃƒÂ£o final de qualidade. EstabeleÃƒÂ§a prazos para  verificaÃƒÂ§ÃƒÂ£o da qualidade. AlÃƒÂ©m disso, divida as tarefas em partes com prazos distintos para que vocÃƒÂª evite uma crise de ÃƒÂºltima hora.;;;;;;ACT;1;1
LearningActivity;9077;pt_BR;Verifique as metas contra objetivos organizacionais. Certifique-se de que o foco de seu time ÃƒÂ© a evoluÃƒÂ§ÃƒÂ£o das necessidades organizacionais.;9001;Verifique as metas contra objetivos organizacionais. Certifique-se de que o foco de seu time ÃƒÂ© a evoluÃƒÂ§ÃƒÂ£o das necessidades organizacionais.;;;;;;ACT;1;1
LearningActivity;9163;pt_BR;ReconheÃƒÂ§a as realizaÃƒÂ§ÃƒÂµes imediatamente. NÃƒÂ£o demore muito para reconhecer um trabalho gratificante. Mesmo se um aumento ou bÃƒÂ´nus for o resultado futuro do trabalho duro feito hoje, certifique-se de que seus reconhecimentos sÃƒÂ£o feitos enquanto as realizaÃƒÂ§ÃƒÂµes ainda estÃƒÂ£o frescas na mente das pessoas.;9001;ReconheÃƒÂ§a as realizaÃƒÂ§ÃƒÂµes imediatamente. NÃƒÂ£o demore muito para reconhecer um trabalho gratificante. Mesmo se um aumento ou bÃƒÂ´nus for o resultado futuro do trabalho duro feito hoje, certifique-se de que seus reconhecimentos sÃƒÂ£o feitos enquanto as realizaÃƒÂ§ÃƒÂµes ainda estÃƒÂ£o frescas na mente das pessoas.;;;;;;ACT;1;1
LearningActivity;9008;pt_BR;Expanda contatos. FaÃƒÂ§a contatos informais em outros grupos e departamentos para ampliar o seu conhecimento das operaÃƒÂ§ÃƒÂµes organizacionais. Desenvolva novos contatos que podem lhe dar uma nova visÃƒÂ£o e adicionar mais profundidade a seus planos.;9001;Expanda contatos. FaÃƒÂ§a contatos informais em outros grupos e departamentos para ampliar o seu conhecimento das operaÃƒÂ§ÃƒÂµes organizacionais. Desenvolva novos contatos que podem lhe dar uma nova visÃƒÂ£o e adicionar mais profundidade a seus planos.;;;;;;ACT;1;1
LearningActivity;9275;pt_BR;Tenha uma atitude pro ativa. Trate um pedido de outros departamentos, colegas de trabalho, e aliados comerciais como se fosse um pedido de clientes externos da empresa. Procure maneiras de satisfazer as necessidades e os prazos dos clientes internos.;9001;Tenha uma atitude pro ativa. Trate um pedido de outros departamentos, colegas de trabalho, e aliados comerciais como se fosse um pedido de clientes externos da empresa. Procure maneiras de satisfazer as necessidades e os prazos dos clientes internos.;;;;;;ACT;1;1
LearningActivity;9102;pt_BR;Necessidades de desenvolvimento. Monte uma lista das necessidades de desenvolvimento mais importantes de cada funcionÃƒÂ¡rio. Consulte a lista regularmente para atender ÃƒÂ s necessidades de futuras oportunidades para os treinamentos on-the-job ou formais.;9001;Necessidades de desenvolvimento. Monte uma lista das necessidades de desenvolvimento mais importantes de cada funcionÃƒÂ¡rio. Consulte a lista regularmente para atender ÃƒÂ s necessidades de futuras oportunidades para os treinamentos on-the-job ou formais.;;;;;;ACT;1;1
LearningActivity;9068;pt_BR;"Esteja sempre preparado (apresentaÃƒÂ§ÃƒÂµes). a) Sempre crie uma agenda. Agendas ajudam nÃƒÂ£o sÃƒÂ³ o ouvinte, mas tambÃƒÂ©m o apresentador por forÃƒÂ§ÃƒÂ¡-lo a pensar sobre as principais questÃƒÂµes ÃƒÂ  frente da apresentaÃƒÂ§ÃƒÂ£o. b) Use um espelho. Ensaie uma apresentaÃƒÂ§ÃƒÂ£o na frente de um espelho, ou de uma filmadora, ÃƒÂ© uma excelente maneira de descobrir e eliminar pontos fracos. Fique de olho em sua linguagem corporal e tom de voz. c) Use lembretes. A fim de evitar esquecer ideias principais ou cita-las fora de ordem, prepare um esboÃƒÂ§o em um cartÃƒÂ£o e mantenha-o a sua frente em todos os momentos. d) Desenvolva truques que estimulem o interesse e atenÃƒÂ§ÃƒÂ£o do pÃƒÂºblico. Pense sobre os principais benefÃƒÂ­cios que sua apresentaÃƒÂ§ÃƒÂ£o poderÃƒÂ¡ trazer, e fale logo no comeÃƒÂ§o. Por exemplo: "". A informaÃƒÂ§ÃƒÂ£o que descobri, irÃƒÂ¡ tornar mais fÃƒÂ¡cil sua relaÃƒÂ§ÃƒÂ£o com os clientes"" e) Antecipe perguntas e prepare respostas rÃƒÂ¡pidas com antecedÃƒÂªncia. f) Planeje algumas perguntas para envolver o pÃƒÂºblico, tais como: "". Gostaria de ouvir que vocÃƒÂª tem feito atÃƒÂ© agora para lidar com este tipo de problema. SerÃƒÂ¡ que alguÃƒÂ©m gostaria de me dar um resumo rÃƒÂ¡pido?""";9001;"Esteja sempre preparado (apresentaÃƒÂ§ÃƒÂµes). a) Sempre crie uma agenda. Agendas ajudam nÃƒÂ£o sÃƒÂ³ o ouvinte, mas tambÃƒÂ©m o apresentador por forÃƒÂ§ÃƒÂ¡-lo a pensar sobre as principais questÃƒÂµes ÃƒÂ  frente da apresentaÃƒÂ§ÃƒÂ£o. b) Use um espelho. Ensaie uma apresentaÃƒÂ§ÃƒÂ£o na frente de um espelho, ou de uma filmadora, ÃƒÂ© uma excelente maneira de descobrir e eliminar pontos fracos. Fique de olho em sua linguagem corporal e tom de voz. c) Use lembretes. A fim de evitar esquecer ideias principais ou cita-las fora de ordem, prepare um esboÃƒÂ§o em um cartÃƒÂ£o e mantenha-o a sua frente em todos os momentos. d) Desenvolva truques que estimulem o interesse e atenÃƒÂ§ÃƒÂ£o do pÃƒÂºblico. Pense sobre os principais benefÃƒÂ­cios que sua apresentaÃƒÂ§ÃƒÂ£o poderÃƒÂ¡ trazer, e fale logo no comeÃƒÂ§o. Por exemplo: "". A informaÃƒÂ§ÃƒÂ£o que descobri, irÃƒÂ¡ tornar mais fÃƒÂ¡cil sua relaÃƒÂ§ÃƒÂ£o com os clientes"" e) Antecipe perguntas e prepare respostas rÃƒÂ¡pidas com antecedÃƒÂªncia. f) Planeje algumas perguntas para envolver o pÃƒÂºblico, tais como: "". Gostaria de ouvir que vocÃƒÂª tem feito atÃƒÂ© agora para lidar com este tipo de problema. SerÃƒÂ¡ que alguÃƒÂ©m gostaria de me dar um resumo rÃƒÂ¡pido?""";;;;;;ACT;1;1
LearningActivity;9083;pt_BR;"Crie uma lista de ""eu nÃƒÂ£o sei"". Toda vez que vocÃƒÂª nÃƒÂ£o conseguir responder a uma pergunta sobre a empresa, anote a questÃƒÂ£o e encontre a resposta.";9001;"Crie uma lista de ""eu nÃƒÂ£o sei"". Toda vez que vocÃƒÂª nÃƒÂ£o conseguir responder a uma pergunta sobre a empresa, anote a questÃƒÂ£o e encontre a resposta.";;;;;;ACT;1;1
LearningActivity;9181;pt_BR;Demonstre como os esforÃƒÂ§os contribuem para os resultados da empresa. O trabalho ÃƒÂ© mais bem sucedido, quando, os membros da equipe sabem a contribuiÃƒÂ§ÃƒÂ£o que seu projeto tem para o sucesso da empresa. Comunique o impacto do trabalho deles.;9001;Demonstre como os esforÃƒÂ§os contribuem para os resultados da empresa. O trabalho ÃƒÂ© mais bem sucedido, quando, os membros da equipe sabem a contribuiÃƒÂ§ÃƒÂ£o que seu projeto tem para o sucesso da empresa. Comunique o impacto do trabalho deles.;;;;;;ACT;1;1
LearningActivity;9088;pt_BR;Desenvolva seu prÃƒÂ³prio sistema de rastreamento. Pergunte aos seus colegas o que funciona melhor para eles, em seguida, use uma combinaÃƒÂ§ÃƒÂ£o de mÃƒÂ©todos que vocÃƒÂª encontrarÃƒÂ¡, que serÃƒÂ£o fÃƒÂ¡ceis de usar.;9001;Desenvolva seu prÃƒÂ³prio sistema de rastreamento. Pergunte aos seus colegas o que funciona melhor para eles, em seguida, use uma combinaÃƒÂ§ÃƒÂ£o de mÃƒÂ©todos que vocÃƒÂª encontrarÃƒÂ¡, que serÃƒÂ£o fÃƒÂ¡ceis de usar.;;;;;;ACT;1;1
LearningActivity;9110;pt_BR;Junte-se a um grupo da indÃƒÂºstria. Junte-se a uma associaÃƒÂ§ÃƒÂ£o da indÃƒÂºstria, tornar-se membro de um dos grupos de trabalho pode ser uma ÃƒÂ³tima maneira de aprender sobre o que estÃƒÂ¡ acontecendo com a tecnologia em sua ÃƒÂ¡rea, os problemas e as liÃƒÂ§ÃƒÂµes aprendidas. Isto pode vir a ser de muito valor e ajudarÃƒÂ¡ vocÃƒÂª a transformar uma nova tecnologia em um canal de lucro ao invÃƒÂ©s de um ralo de custos.;9001;Junte-se a um grupo da indÃƒÂºstria. Junte-se a uma associaÃƒÂ§ÃƒÂ£o da indÃƒÂºstria, tornar-se membro de um dos grupos de trabalho pode ser uma ÃƒÂ³tima maneira de aprender sobre o que estÃƒÂ¡ acontecendo com a tecnologia em sua ÃƒÂ¡rea, os problemas e as liÃƒÂ§ÃƒÂµes aprendidas. Isto pode vir a ser de muito valor e ajudarÃƒÂ¡ vocÃƒÂª a transformar uma nova tecnologia em um canal de lucro ao invÃƒÂ©s de um ralo de custos.;;;;;;ACT;1;1
LearningActivity;9237;pt_BR;Mantenha o foco. Foque a agenda sobre o principal objetivo que vocÃƒÂª definiu para a reuniÃƒÂ£o. FaÃƒÂ§a disso uma prioridade antes de tratar outras questÃƒÂµes.;9001;Mantenha o foco. Foque a agenda sobre o principal objetivo que vocÃƒÂª definiu para a reuniÃƒÂ£o. FaÃƒÂ§a disso uma prioridade antes de tratar outras questÃƒÂµes.;;;;;;ACT;1;1
LearningActivity;9149;pt_BR;Potenciais Clientes. Identifique seus potenciais clientes, e adapte as promoÃƒÂ§ÃƒÂµes e programas de incentivo as suas necessidades de produtos. Certifique-se de que eles saibam que vocÃƒÂª estÃƒÂ¡ dando-lhes uma atenÃƒÂ§ÃƒÂ£o especial.;9001;Potenciais Clientes. Identifique seus potenciais clientes, e adapte as promoÃƒÂ§ÃƒÂµes e programas de incentivo as suas necessidades de produtos. Certifique-se de que eles saibam que vocÃƒÂª estÃƒÂ¡ dando-lhes uma atenÃƒÂ§ÃƒÂ£o especial.;;;;;;ACT;1;1
