ENTRY_TYPE;GUID;LOCALE;ENTRY_NAME;PARENT_ENTRY_ID;FIELD1;FIELD2;FIELD3;FIELD4;FIELD5;FIELD6;ACTIVITY;ACTIVE;EDITABLE
LearningActivity;9055;pt_BR;Use toda a equipe. Alavanque o que vocÃƒÂª jÃƒÂ¡ tem, antes de sair procurando outros funcionÃƒÂ¡rios. Concentre-se na produtividade de sua equipe, e nÃƒÂ£o apenas sobre as partes individuais. Considere alguma pequena reestruturaÃƒÂ§ÃƒÂ£o de responsabilidades para combinar forÃƒÂ§as e interesses para as tarefas. ÃƒÂreas fracas podem ser cobertas de forma mais eficiente por outro funcionÃƒÂ¡rio(a), que por sua vez pode ser ajudado por outro(a) em outra ÃƒÂ¡rea.;9001;Use toda a equipe. Alavanque o que vocÃƒÂª jÃƒÂ¡ tem, antes de sair procurando outros funcionÃƒÂ¡rios. Concentre-se na produtividade de sua equipe, e nÃƒÂ£o apenas sobre as partes individuais. Considere alguma pequena reestruturaÃƒÂ§ÃƒÂ£o de responsabilidades para combinar forÃƒÂ§as e interesses para as tarefas. ÃƒÂreas fracas podem ser cobertas de forma mais eficiente por outro funcionÃƒÂ¡rio(a), que por sua vez pode ser ajudado por outro(a) em outra ÃƒÂ¡rea.;;;;;;ACT;1;1
LearningActivity;9216;pt_BR;Ajuste quando necessÃƒÂ¡rio. Tome um minuto para reorganizar sua agenda quando uma nova tarefa de alta prioridade vier ÃƒÂ  tona. Reprograme compromissos antes do tempo, se vocÃƒÂª perceber problemas com seus horÃƒÂ¡rios.;9001;Ajuste quando necessÃƒÂ¡rio. Tome um minuto para reorganizar sua agenda quando uma nova tarefa de alta prioridade vier ÃƒÂ  tona. Reprograme compromissos antes do tempo, se vocÃƒÂª perceber problemas com seus horÃƒÂ¡rios.;;;;;;ACT;1;1
LearningActivity;9173;pt_BR;Ajuste a sua posiÃƒÂ§ÃƒÂ£o. Mantenha a mente aberta para o assunto em questÃƒÂ£o. Quando vocÃƒÂª aprende coisas novas que afetam a sua posiÃƒÂ§ÃƒÂ£o, nÃƒÂ£o hesite em reconhecer o mÃƒÂ©rito de suas ideias e mudar a sua visÃƒÂ£o de incorporar novas informaÃƒÂ§ÃƒÂµes.;9001;Ajuste a sua posiÃƒÂ§ÃƒÂ£o. Mantenha a mente aberta para o assunto em questÃƒÂ£o. Quando vocÃƒÂª aprende coisas novas que afetam a sua posiÃƒÂ§ÃƒÂ£o, nÃƒÂ£o hesite em reconhecer o mÃƒÂ©rito de suas ideias e mudar a sua visÃƒÂ£o de incorporar novas informaÃƒÂ§ÃƒÂµes.;;;;;;ACT;1;1
LearningActivity;9139;pt_BR;Procure o feedback dos clientes antes de implementar novas ideias. FaÃƒÂ§a perguntas diretas aos clientes sobre ideias propostas antes de tomar uma decisÃƒÂ£o final sobre como proceder.;9001;Procure o feedback dos clientes antes de implementar novas ideias. FaÃƒÂ§a perguntas diretas aos clientes sobre ideias propostas antes de tomar uma decisÃƒÂ£o final sobre como proceder.;;;;;;ACT;1;1
LearningActivity;9024;pt_BR;Conversas informais. Passe algum tempo conversando informalmente com novos colegas de trabalho sobre os interesses pessoais e outros assuntos fora do trabalho.;9001;Conversas informais. Passe algum tempo conversando informalmente com novos colegas de trabalho sobre os interesses pessoais e outros assuntos fora do trabalho.;;;;;;ACT;1;1
LearningActivity;9043;pt_BR;Envolva a equipe. DÃƒÂª alguma oportunidade de decisÃƒÂ£o ÃƒÂ  equipe. PeÃƒÂ§a para eles lhe darem imputs e mantenha-os bem informados.;9001;Envolva a equipe. DÃƒÂª alguma oportunidade de decisÃƒÂ£o ÃƒÂ  equipe. PeÃƒÂ§a para eles lhe darem imputs e mantenha-os bem informados.;;;;;;ACT;1;1
LearningActivity;9122;pt_BR;Treinamento on-the-job. Coloque empregados em projetos que desenvolva a sua experiÃƒÂªncia. Leve-os a trabalhar com gerentes e com outros departamentos para expandir seu conhecimento e responsabilidade.;9001;Treinamento on-the-job. Coloque empregados em projetos que desenvolva a sua experiÃƒÂªncia. Leve-os a trabalhar com gerentes e com outros departamentos para expandir seu conhecimento e responsabilidade.;;;;;;ACT;1;1
LearningActivity;9269;pt_BR;Elimine as barreiras organizacionais para a inovaÃƒÂ§ÃƒÂ£o. Remova as barreiras polÃƒÂ­ticas que podem ficar no caminho da criaÃƒÂ§ÃƒÂ£o de um ambiente inovador.;9001;Elimine as barreiras organizacionais para a inovaÃƒÂ§ÃƒÂ£o. Remova as barreiras polÃƒÂ­ticas que podem ficar no caminho da criaÃƒÂ§ÃƒÂ£o de um ambiente inovador.;;;;;;ACT;1;1
LearningActivity;9067;pt_BR;Seja aberto em situaÃƒÂ§ÃƒÂµes difÃƒÂ­ceis. Explique questÃƒÂµes controversas para seu pessoal e sua gestÃƒÂ£o antes de tomar uma decisÃƒÂ£o. Inicie o processo o mais cedo possÃƒÂ­vel para suavizar a transiÃƒÂ§ÃƒÂ£o.;9001;Seja aberto em situaÃƒÂ§ÃƒÂµes difÃƒÂ­ceis. Explique questÃƒÂµes controversas para seu pessoal e sua gestÃƒÂ£o antes de tomar uma decisÃƒÂ£o. Inicie o processo o mais cedo possÃƒÂ­vel para suavizar a transiÃƒÂ§ÃƒÂ£o.;;;;;;ACT;1;1
LearningActivity;9052;pt_BR;Troque tarefas dentro da equipe. Alternar temporariamente responsabilidades, da aos funcionÃƒÂ¡rios novas perspectivas e habilidades.;9001;Troque tarefas dentro da equipe. Alternar temporariamente responsabilidades, da aos funcionÃƒÂ¡rios novas perspectivas e habilidades.;;;;;;ACT;1;1
LearningActivity;9039;pt_BR;Tenha um mentor. Procure a ajuda de um especialista, que pode ajudÃƒÂ¡-lo a aprender sobre sua ÃƒÂ¡rea de desenvolvimento e fornecer-lhe orientaÃƒÂ§ÃƒÂ£o contÃƒÂ­nua. Envolva outras pessoas na aprendizagem.;9001;Tenha um mentor. Procure a ajuda de um especialista, que pode ajudÃƒÂ¡-lo a aprender sobre sua ÃƒÂ¡rea de desenvolvimento e fornecer-lhe orientaÃƒÂ§ÃƒÂ£o contÃƒÂ­nua. Envolva outras pessoas na aprendizagem.;;;;;;ACT;1;1
LearningActivity;9147;pt_BR;Assuma a lideranÃƒÂ§a. Se um novo problema ou oportunidade surgir, desenvolva algumas propostas de soluÃƒÂ§ÃƒÂ£o e, em seguida, mostre aos outros envolvidos. Esteja pronto para agir em suas soluÃƒÂ§ÃƒÂµes, uma vez que vocÃƒÂª estÃƒÂ¡ dando o seu aval.;9001;Assuma a lideranÃƒÂ§a. Se um novo problema ou oportunidade surgir, desenvolva algumas propostas de soluÃƒÂ§ÃƒÂ£o e, em seguida, mostre aos outros envolvidos. Esteja pronto para agir em suas soluÃƒÂ§ÃƒÂµes, uma vez que vocÃƒÂª estÃƒÂ¡ dando o seu aval.;;;;;;ACT;1;1
LearningActivity;9223;pt_BR;Divida. Divida seus grandes projetos em pedaÃƒÂ§os pequenos, cada pedaÃƒÂ§o com o seu prazo. Termine um pedaÃƒÂ§o a cada semana.;9001;Divida. Divida seus grandes projetos em pedaÃƒÂ§os pequenos, cada pedaÃƒÂ§o com o seu prazo. Termine um pedaÃƒÂ§o a cada semana.;;;;;;ACT;1;1
LearningActivity;9240;pt_BR;Saiba o que vocÃƒÂª quer. Decida antes de cada reuniÃƒÂ£o exatamente o que vocÃƒÂª deseja alcanÃƒÂ§ar. Se ÃƒÂ© ou nÃƒÂ£o ÃƒÂ© a sua reuniÃƒÂ£o, pesquise antes para entender o objetivo principal da reuniÃƒÂ£o e como se relaciona com a sua agenda.;9001;Saiba o que vocÃƒÂª quer. Decida antes de cada reuniÃƒÂ£o exatamente o que vocÃƒÂª deseja alcanÃƒÂ§ar. Se ÃƒÂ© ou nÃƒÂ£o ÃƒÂ© a sua reuniÃƒÂ£o, pesquise antes para entender o objetivo principal da reuniÃƒÂ£o e como se relaciona com a sua agenda.;;;;;;ACT;1;1
LearningActivity;9111;pt_BR;ConheÃƒÂ§a a cultura. Se vocÃƒÂª estÃƒÂ¡ em uma negociaÃƒÂ§ÃƒÂ£o pela primeira vez em outro paÃƒÂ­s (ou regiÃƒÂ£o) certifique-se de ler sobre a cultura. Isto lhe ajudarÃƒÂ¡ com o relacionamento, e tambÃƒÂ©m lhe darÃƒÂ¡ uma visÃƒÂ£o sobre certos costumes e atitudes que podem afetar as negociaÃƒÂ§ÃƒÂµes.;9001;ConheÃƒÂ§a a cultura. Se vocÃƒÂª estÃƒÂ¡ em uma negociaÃƒÂ§ÃƒÂ£o pela primeira vez em outro paÃƒÂ­s (ou regiÃƒÂ£o) certifique-se de ler sobre a cultura. Isto lhe ajudarÃƒÂ¡ com o relacionamento, e tambÃƒÂ©m lhe darÃƒÂ¡ uma visÃƒÂ£o sobre certos costumes e atitudes que podem afetar as negociaÃƒÂ§ÃƒÂµes.;;;;;;ACT;1;1
LearningActivity;9211;pt_BR;Confie na sua equipe. DÃƒÂª um voto de confianÃƒÂ§a ao delegar uma tarefa a alguÃƒÂ©m, mesmo se vocÃƒÂª nÃƒÂ£o tiver certeza da capacidade da pessoa para entregar. Sua confianÃƒÂ§a pode inspirar e motivar a dedicaÃƒÂ§ÃƒÂ£o ÃƒÂ  tarefa.;9001;Confie na sua equipe. DÃƒÂª um voto de confianÃƒÂ§a ao delegar uma tarefa a alguÃƒÂ©m, mesmo se vocÃƒÂª nÃƒÂ£o tiver certeza da capacidade da pessoa para entregar. Sua confianÃƒÂ§a pode inspirar e motivar a dedicaÃƒÂ§ÃƒÂ£o ÃƒÂ  tarefa.;;;;;;ACT;1;1
LearningActivity;9092;pt_BR;Encontre novas fontes de dados e mÃƒÂ©todos de coletas. Explore alternativas para suas fontes de dados atuais. Procure por fontes que sÃƒÂ£o mais atualizadas, que tenham mais conteÃƒÂºdo, que fornecem interpretaÃƒÂ§ÃƒÂ£o, ou que apresentem os dados de forma mais clara e abrangente do que as fontes atuais.;9001;Encontre novas fontes de dados e mÃƒÂ©todos de coletas. Explore alternativas para suas fontes de dados atuais. Procure por fontes que sÃƒÂ£o mais atualizadas, que tenham mais conteÃƒÂºdo, que fornecem interpretaÃƒÂ§ÃƒÂ£o, ou que apresentem os dados de forma mais clara e abrangente do que as fontes atuais.;;;;;;ACT;1;1
LearningActivity;9027;pt_BR;Sintonize seu network. Use seus contatos informais em outros departamentos e organizaÃƒÂ§ÃƒÂµes para ficar sabendo de novas tendÃƒÂªncias. Desenvolva novos contatos nas ÃƒÂ¡reas de negÃƒÂ³cios em que vocÃƒÂª teve dificuldade para manter-se atualizado.;9001;Sintonize seu network. Use seus contatos informais em outros departamentos e organizaÃƒÂ§ÃƒÂµes para ficar sabendo de novas tendÃƒÂªncias. Desenvolva novos contatos nas ÃƒÂ¡reas de negÃƒÂ³cios em que vocÃƒÂª teve dificuldade para manter-se atualizado.;;;;;;ACT;1;1
LearningActivity;9252;pt_BR;Defina prazos claros. Trabalhe com o(a) [Nome do Empregado] para configurar um grÃƒÂ¡fico passo-a-passo de progresso para garantir que ele(a) nÃƒÂ£o se perca em pequenos detalhes.;9001;Defina prazos claros. Trabalhe com o(a) [Nome do Empregado] para configurar um grÃƒÂ¡fico passo-a-passo de progresso para garantir que ele(a) nÃƒÂ£o se perca em pequenos detalhes.;;;;;;ACT;1;1
LearningActivity;9028;pt_BR;Use seus contatos, e faÃƒÂ§a novos. Use contatos informais em outros grupos e departamentos para aumentar a sua base de conhecimento e obter mais profundidade em seus planos.;9001;Use seus contatos, e faÃƒÂ§a novos. Use contatos informais em outros grupos e departamentos para aumentar a sua base de conhecimento e obter mais profundidade em seus planos.;;;;;;ACT;1;1
LearningActivity;9034;pt_BR;Seja solidÃƒÂ¡rio e sugira treinamento. ForneÃƒÂ§a todos os recursos possÃƒÂ­veis para que seus empregados alcancem o sucesso. Disponibilize tempo para a participaÃƒÂ§ÃƒÂ£o de treinamentos apropriados. Esteja aberto para perguntas e adie as respostas quando vocÃƒÂª estiver em dÃƒÂºvida.;9001;Seja solidÃƒÂ¡rio e sugira treinamento. ForneÃƒÂ§a todos os recursos possÃƒÂ­veis para que seus empregados alcancem o sucesso. Disponibilize tempo para a participaÃƒÂ§ÃƒÂ£o de treinamentos apropriados. Esteja aberto para perguntas e adie as respostas quando vocÃƒÂª estiver em dÃƒÂºvida.;;;;;;ACT;1;1
LearningActivity;9069;pt_BR;"Esteja preparado (feedback). Evite comentÃƒÂ¡rios vagos, como ""VocÃƒÂª precisa melhorar nessa ÃƒÂ¡rea"". Em vez disso, identifique como a melhoria pode ser realizada antes da reuniÃƒÂ£o com o empregado. Determine quais recursos estÃƒÂ£o disponÃƒÂ­veis para o desenvolvimento, a literatura, ou seminÃƒÂ¡rios. Especifique qual serÃƒÂ¡ o resultado, de modo que haverÃƒÂ¡ uma maneira clara de medir se a mudanÃƒÂ§a ocorreu. Finalmente, acompanhe estas atividades de desenvolvimento e verifique se ela resultaram em mudanÃƒÂ§as comportamentais.         ";9001;"Esteja preparado (feedback). Evite comentÃƒÂ¡rios vagos, como ""VocÃƒÂª precisa melhorar nessa ÃƒÂ¡rea"". Em vez disso, identifique como a melhoria pode ser realizada antes da reuniÃƒÂ£o com o empregado. Determine quais recursos estÃƒÂ£o disponÃƒÂ­veis para o desenvolvimento, a literatura, ou seminÃƒÂ¡rios. Especifique qual serÃƒÂ¡ o resultado, de modo que haverÃƒÂ¡ uma maneira clara de medir se a mudanÃƒÂ§a ocorreu. Finalmente, acompanhe estas atividades de desenvolvimento e verifique se ela resultaram em mudanÃƒÂ§as comportamentais.         ";;;;;;ACT;1;1
LearningActivity;9259;pt_BR;Use exemplos. Mostre aos empregados o que ÃƒÂ© um bom plano de marketing e como os dados sÃƒÂ£o usados para tomar decisÃƒÂµes estratÃƒÂ©gicas.;9001;Use exemplos. Mostre aos empregados o que ÃƒÂ© um bom plano de marketing e como os dados sÃƒÂ£o usados para tomar decisÃƒÂµes estratÃƒÂ©gicas.;;;;;;ACT;1;1
LearningActivity;9042;pt_BR;Delegar a resoluÃƒÂ§ÃƒÂ£o de problemas. Delegue autoridade aos subordinados. Lembre-se que vocÃƒÂª tem limitaÃƒÂ§ÃƒÂµes de tempo e tambÃƒÂ©m nÃƒÂ£o pode estar sempre disponÃƒÂ­vel. Fique atento a possÃƒÂ­veis atrasos e insatisfaÃƒÂ§ÃƒÂµes do cliente.;9001;Delegar a resoluÃƒÂ§ÃƒÂ£o de problemas. Delegue autoridade aos subordinados. Lembre-se que vocÃƒÂª tem limitaÃƒÂ§ÃƒÂµes de tempo e tambÃƒÂ©m nÃƒÂ£o pode estar sempre disponÃƒÂ­vel. Fique atento a possÃƒÂ­veis atrasos e insatisfaÃƒÂ§ÃƒÂµes do cliente.;;;;;;ACT;1;1
LearningActivity;9032;pt_BR;Seja ou forneÃƒÂ§a um mentor. Mostre interesse na aprendizagem e desenvolvimento de seus empregados. DÃƒÂª-lhes pessoalmente, treinamentos para expandir o seu conhecimento, e incentive-os a aprender com outros funcionÃƒÂ¡rios em cargos de lideranÃƒÂ§a.;9001;Seja ou forneÃƒÂ§a um mentor. Mostre interesse na aprendizagem e desenvolvimento de seus empregados. DÃƒÂª-lhes pessoalmente, treinamentos para expandir o seu conhecimento, e incentive-os a aprender com outros funcionÃƒÂ¡rios em cargos de lideranÃƒÂ§a.;;;;;;ACT;1;1
LearningActivity;9179;pt_BR;Comunique as metas de longo prazo. Deixe sua equipe saber onde vocÃƒÂª quer ir e por quÃƒÂª. Coloque e comunique seus prazos para atingir essas metas.;9001;Comunique as metas de longo prazo. Deixe sua equipe saber onde vocÃƒÂª quer ir e por quÃƒÂª. Coloque e comunique seus prazos para atingir essas metas.;;;;;;ACT;1;1
LearningActivity;9270;pt_BR;Expanda o seu prÃƒÂ³prio cargo. PeÃƒÂ§a para ser atribuÃƒÂ­do a novos projetos e ÃƒÂ¡reas de trabalho em que vocÃƒÂª tem interesses de carreira a longo prazo. Converse com o seu gerente, se vocÃƒÂª quer mudar o foco do seu trabalho ou passar mais tempo em uma determinada ÃƒÂ¡rea de trabalho.;9001;Expanda o seu prÃƒÂ³prio cargo. PeÃƒÂ§a para ser atribuÃƒÂ­do a novos projetos e ÃƒÂ¡reas de trabalho em que vocÃƒÂª tem interesses de carreira a longo prazo. Converse com o seu gerente, se vocÃƒÂª quer mudar o foco do seu trabalho ou passar mais tempo em uma determinada ÃƒÂ¡rea de trabalho.;;;;;;ACT;1;1
LearningActivity;9053;pt_BR;DÃƒÂª uma chance a sua equipe. ReconheÃƒÂ§a que, as falhas ocasionais devem ser aceitas se vocÃƒÂª quiser descobrir oportunidades e encontrar soluÃƒÂ§ÃƒÂµes inovadoras para os problemas. Comece com pequenos projetos, quando o impacto da falha ÃƒÂ© mÃƒÂ­nima, entÃƒÂ£o, trabalhe atÃƒÂ© projetos mais crÃƒÂ­ticos.;9001;DÃƒÂª uma chance a sua equipe. ReconheÃƒÂ§a que, as falhas ocasionais devem ser aceitas se vocÃƒÂª quiser descobrir oportunidades e encontrar soluÃƒÂ§ÃƒÂµes inovadoras para os problemas. Comece com pequenos projetos, quando o impacto da falha ÃƒÂ© mÃƒÂ­nima, entÃƒÂ£o, trabalhe atÃƒÂ© projetos mais crÃƒÂ­ticos.;;;;;;ACT;1;1
LearningActivity;9054;pt_BR;Compreenda objetivos de carreira. Aproveite o tempo para aprender sobre os objetivos de carreira dos funcionÃƒÂ¡rios. Compreenda as habilidades de que eles precisam para avanÃƒÂ§ar, e ajude-os a desenvolve-las de maneiras que irÃƒÂ£o beneficiar o grupo. AlÃƒÂ©m disso, procure maneiras de manter seus planos de carreira dentro da empresa.;9001;Compreenda objetivos de carreira. Aproveite o tempo para aprender sobre os objetivos de carreira dos funcionÃƒÂ¡rios. Compreenda as habilidades de que eles precisam para avanÃƒÂ§ar, e ajude-os a desenvolve-las de maneiras que irÃƒÂ£o beneficiar o grupo. AlÃƒÂ©m disso, procure maneiras de manter seus planos de carreira dentro da empresa.;;;;;;ACT;1;1
LearningActivity;9112;pt_BR;Conhecer as questÃƒÂµes. Estude as questÃƒÂµes que vocÃƒÂª faria se estivesse entrando em um debate. Entenda as necessidades da outra parte bem o suficiente para antecipar as suas respostas ÃƒÂ s suas propostas. Traga um especialista com vocÃƒÂª, se vocÃƒÂª precisar de suporte tÃƒÂ©cnico extra.;9001;Conhecer as questÃƒÂµes. Estude as questÃƒÂµes que vocÃƒÂª faria se estivesse entrando em um debate. Entenda as necessidades da outra parte bem o suficiente para antecipar as suas respostas ÃƒÂ s suas propostas. Traga um especialista com vocÃƒÂª, se vocÃƒÂª precisar de suporte tÃƒÂ©cnico extra.;;;;;;ACT;1;1
LearningActivity;9074;pt_BR;Qualidade no ambiente de trabalho . Defina as expectativas para cada empregado, fazendo da qualidade uma parte da descriÃƒÂ§ÃƒÂ£o do trabalho, objetivos, e medidas de desempenho.;9001;Qualidade no ambiente de trabalho . Defina as expectativas para cada empregado, fazendo da qualidade uma parte da descriÃƒÂ§ÃƒÂ£o do trabalho, objetivos, e medidas de desempenho.;;;;;;ACT;1;1
LearningActivity;9059;pt_BR;Antecipe obstÃƒÂ¡culos. Passe algum tempo pensando em todas as coisas que podem dar errado. FaÃƒÂ§a um plano para evitar ou lidar com eles antes que eles ocorram, assim vocÃƒÂª vai estar preparado quando eles acontecerem.;9001;Antecipe obstÃƒÂ¡culos. Passe algum tempo pensando em todas as coisas que podem dar errado. FaÃƒÂ§a um plano para evitar ou lidar com eles antes que eles ocorram, assim vocÃƒÂª vai estar preparado quando eles acontecerem.;;;;;;ACT;1;1
LearningActivity;9230;pt_BR;Dedique uma hora por dia para questÃƒÂµes de alta prioridade. FaÃƒÂ§a uma promessa para passar uma hora (ou duas, trÃƒÂªs, etc.), por dia em seus projetos mais importantes. NÃƒÂ£o pegue outro trabalho atÃƒÂ© que vocÃƒÂª coloque estes em dia.;9001;Dedique uma hora por dia para questÃƒÂµes de alta prioridade. FaÃƒÂ§a uma promessa para passar uma hora (ou duas, trÃƒÂªs, etc.), por dia em seus projetos mais importantes. NÃƒÂ£o pegue outro trabalho atÃƒÂ© que vocÃƒÂª coloque estes em dia.;;;;;;ACT;1;1
LearningActivity;9025;pt_BR;Fale com mais de uma pessoa. Quando vocÃƒÂª acha que tem informaÃƒÂ§ÃƒÂµes suficientes, mostre sua proposta para mais de uma pessoa.;9001;Fale com mais de uma pessoa. Quando vocÃƒÂª acha que tem informaÃƒÂ§ÃƒÂµes suficientes, mostre sua proposta para mais de uma pessoa.;;;;;;ACT;1;1
LearningActivity;9221;pt_BR;Seja seletivo sobre o que ÃƒÂ© urgente. NÃƒÂ£o faÃƒÂ§a de cada detalhe uma situaÃƒÂ§ÃƒÂ£o urgente ou crie incÃƒÂªndios desnecessÃƒÂ¡rios.;9001;Seja seletivo sobre o que ÃƒÂ© urgente. NÃƒÂ£o faÃƒÂ§a de cada detalhe uma situaÃƒÂ§ÃƒÂ£o urgente ou crie incÃƒÂªndios desnecessÃƒÂ¡rios.;;;;;;ACT;1;1
LearningActivity;9213;pt_BR;Haja de acordo com o que vocÃƒÂª fala. Permita que os membros da sua equipe veja que um excelente serviÃƒÂ§o ao cliente ÃƒÂ© tudo. Interaja com os clientes de uma forma regular, com uma atitude positiva, e com empatia.;9001;Haja de acordo com o que vocÃƒÂª fala. Permita que os membros da sua equipe veja que um excelente serviÃƒÂ§o ao cliente ÃƒÂ© tudo. Interaja com os clientes de uma forma regular, com uma atitude positiva, e com empatia.;;;;;;ACT;1;1
LearningActivity;9107;pt_BR;Melhore suas tÃƒÂ©cnicas de venda. Observe as pessoas que sÃƒÂ£o persuasivas e incorpore algumas de suas tÃƒÂ©cnicas. Obtenha feedback sobre a sua capacidade de ser persuasivo.;9001;Melhore suas tÃƒÂ©cnicas de venda. Observe as pessoas que sÃƒÂ£o persuasivas e incorpore algumas de suas tÃƒÂ©cnicas. Obtenha feedback sobre a sua capacidade de ser persuasivo.;;;;;;ACT;1;1
LearningActivity;9169;pt_BR;Passe todas as notÃƒÂ­cias. Passe todas as informaÃƒÂ§ÃƒÂµes para a equipe, boas ou ruins. Mencionar mesmo uma pequena vitÃƒÂ³ria ou pouco progresso, pode ter um efeito estimulante para os membros da equipe. FaÃƒÂ§a isso tambÃƒÂ©m para as mÃƒÂ¡s notÃƒÂ­cias, para evitar especulaÃƒÂ§ÃƒÂµes.;9001;Passe todas as notÃƒÂ­cias. Passe todas as informaÃƒÂ§ÃƒÂµes para a equipe, boas ou ruins. Mencionar mesmo uma pequena vitÃƒÂ³ria ou pouco progresso, pode ter um efeito estimulante para os membros da equipe. FaÃƒÂ§a isso tambÃƒÂ©m para as mÃƒÂ¡s notÃƒÂ­cias, para evitar especulaÃƒÂ§ÃƒÂµes.;;;;;;ACT;1;1
LearningActivity;9066;pt_BR;Participe de reuniÃƒÂµes, convenÃƒÂ§ÃƒÂµes, seminÃƒÂ¡rios. VocÃƒÂª pode fazer contatos no evento. Procure os contatos que serÃƒÂ£o mais influentes para a sua ÃƒÂ¡rea.;9001;Participe de reuniÃƒÂµes, convenÃƒÂ§ÃƒÂµes, seminÃƒÂ¡rios. VocÃƒÂª pode fazer contatos no evento. Procure os contatos que serÃƒÂ£o mais influentes para a sua ÃƒÂ¡rea.;;;;;;ACT;1;1
LearningActivity;9011;pt_BR;Contato com o cliente (para subordinado). Se o (a) [Nome do empregado (a)] tem pouco contato direto com os clientes da sua empresa, encontre uma maneira de levÃƒÂ¡-lo(a) atÃƒÂ© eles. Aprender mais sobre as necessidades do cliente pode dar o (a) [Nome do empregado] um novo insight sobre o que a visÃƒÂ£o da empresa realmente significa no nÃƒÂ­vel do cliente.;9001;Contato com o cliente (para subordinado). Se o (a) [Nome do empregado (a)] tem pouco contato direto com os clientes da sua empresa, encontre uma maneira de levÃƒÂ¡-lo(a) atÃƒÂ© eles. Aprender mais sobre as necessidades do cliente pode dar o (a) [Nome do empregado] um novo insight sobre o que a visÃƒÂ£o da empresa realmente significa no nÃƒÂ­vel do cliente.;;;;;;ACT;1;1
LearningActivity;9128;pt_BR;FaÃƒÂ§a planos de contingÃƒÂªncia. Identifique os fatores internos e externos que podem afetar o projeto ou planos de aquisiÃƒÂ§ÃƒÂ£o de recursos. Desenvolva planos de contingÃƒÂªncia bÃƒÂ¡sicos para que vocÃƒÂª possa se mover rapidamente para obter recursos e manter o projeto em movimento.;9001;FaÃƒÂ§a planos de contingÃƒÂªncia. Identifique os fatores internos e externos que podem afetar o projeto ou planos de aquisiÃƒÂ§ÃƒÂ£o de recursos. Desenvolva planos de contingÃƒÂªncia bÃƒÂ¡sicos para que vocÃƒÂª possa se mover rapidamente para obter recursos e manter o projeto em movimento.;;;;;;ACT;1;1
LearningActivity;9283;pt_BR;Fale com especialistas em orÃƒÂ§amento. NÃƒÂ£o hesite em falar com as pessoas no departamento financeiro sobre seus orÃƒÂ§amentos e o processo orÃƒÂ§amentÃƒÂ¡rio como um todo. FaÃƒÂ§a uma reuniÃƒÂ£o informal com uma pessoa da equipe de finanÃƒÂ§as, se vocÃƒÂª quiser saber mais sobre o lugar da sua equipe no processo de orÃƒÂ§amentaÃƒÂ§ÃƒÂ£o organizacional. AlÃƒÂ©m disso, nÃƒÂ£o se esqueÃƒÂ§a de falar com os especialistas em orÃƒÂ§amento: lineworkers, vendedores e outros que estÃƒÂ£o bem em cima das tendÃƒÂªncias que afetarÃƒÂ£o os seus orÃƒÂ§amentos.;9001;Fale com especialistas em orÃƒÂ§amento. NÃƒÂ£o hesite em falar com as pessoas no departamento financeiro sobre seus orÃƒÂ§amentos e o processo orÃƒÂ§amentÃƒÂ¡rio como um todo. FaÃƒÂ§a uma reuniÃƒÂ£o informal com uma pessoa da equipe de finanÃƒÂ§as, se vocÃƒÂª quiser saber mais sobre o lugar da sua equipe no processo de orÃƒÂ§amentaÃƒÂ§ÃƒÂ£o organizacional. AlÃƒÂ©m disso, nÃƒÂ£o se esqueÃƒÂ§a de falar com os especialistas em orÃƒÂ§amento: lineworkers, vendedores e outros que estÃƒÂ£o bem em cima das tendÃƒÂªncias que afetarÃƒÂ£o os seus orÃƒÂ§amentos.;;;;;;ACT;1;1
LearningActivity;9261;pt_BR;Aceite a responsabilidade. Lembre-se, vocÃƒÂª ÃƒÂ© responsÃƒÂ¡vel por completar novas tarefas. Seus colegas de trabalho estÃƒÂ£o contando com vocÃƒÂª para dividir o peso;9001;Aceite a responsabilidade. Lembre-se, vocÃƒÂª ÃƒÂ© responsÃƒÂ¡vel por completar novas tarefas. Seus colegas de trabalho estÃƒÂ£o contando com vocÃƒÂª para dividir o peso;;;;;;ACT;1;1
LearningActivity;9287;pt_BR; Desempenho na FunÃƒÂ§ÃƒÂ£o;9001; Desempenho na FunÃƒÂ§ÃƒÂ£o;;;;;;ACT;1;1
LearningActivity;9282;pt_BR;Assuma riscos. ReconheÃƒÂ§a que as falhas ocasionais devem ser aceitas se vocÃƒÂª quiser descobrir oportunidades e encontrar soluÃƒÂ§ÃƒÂµes inovadoras para os problemas. Comece com pequenos projetos, quando o impacto da falha ÃƒÂ© mÃƒÂ­nimo, entÃƒÂ£o, trabalhe atÃƒÂ© projetos mais crÃƒÂ­ticos.;9001;Assuma riscos. ReconheÃƒÂ§a que as falhas ocasionais devem ser aceitas se vocÃƒÂª quiser descobrir oportunidades e encontrar soluÃƒÂ§ÃƒÂµes inovadoras para os problemas. Comece com pequenos projetos, quando o impacto da falha ÃƒÂ© mÃƒÂ­nimo, entÃƒÂ£o, trabalhe atÃƒÂ© projetos mais crÃƒÂ­ticos.;;;;;;ACT;1;1
