ENTRY_TYPE;GUID;LOCALE;ENTRY_NAME;PARENT_ENTRY_ID;FIELD1;FIELD2;FIELD3;FIELD4;FIELD5;FIELD6;ACTIVITY;ACTIVE;EDITABLE
LearningActivity;9272;pt_BR;"Entre em um modo de resoluÃƒÂ§ÃƒÂ£o de problemas. Siga os seguintes passos para manter um, clima de ganha-ganha nas negociaÃƒÂ§ÃƒÂµes. a) OuÃƒÂ§a ativamente. Mantenha contato com os olhos, use linguagem corporal, parafraseie as declaraÃƒÂ§ÃƒÂµes de outros para mostrar que vocÃƒÂª estÃƒÂ¡ ouvindo e compreenda verdadeiramente seus interesses. b) FaÃƒÂ§a perguntas diretas sobre interesses. Use ""me conte mais sobre"" investigue para obter mais informaÃƒÂ§ÃƒÂµes sobre as necessidades primÃƒÂ¡rias ou problemas que o outro lado estÃƒÂ¡ tentando resolver. c) Resuma as ÃƒÂ¡reas de acordo, e entÃƒÂ£o resolva as poucas discordÃƒÂ¢ncias. Deixe que as pessoas falem sobre suas hesitaÃƒÂ§ÃƒÂµes antes de continuar. d) Certifique-se de ambos os lados compreender claramente as divergÃƒÂªncias, em seguida, tome a iniciativa de propor soluÃƒÂ§ÃƒÂµes. e) Uma vez que seja alcanÃƒÂ§ado um acordo, resuma os benefÃƒÂ­cios para ambos os lados, para que todo mundo tenha um sentimentos positivos sobre o negÃƒÂ³cio.";9001;"Entre em um modo de resoluÃƒÂ§ÃƒÂ£o de problemas. Siga os seguintes passos para manter um, clima de ganha-ganha nas negociaÃƒÂ§ÃƒÂµes. a) OuÃƒÂ§a ativamente. Mantenha contato com os olhos, use linguagem corporal, parafraseie as declaraÃƒÂ§ÃƒÂµes de outros para mostrar que vocÃƒÂª estÃƒÂ¡ ouvindo e compreenda verdadeiramente seus interesses. b) FaÃƒÂ§a perguntas diretas sobre interesses. Use ""me conte mais sobre"" investigue para obter mais informaÃƒÂ§ÃƒÂµes sobre as necessidades primÃƒÂ¡rias ou problemas que o outro lado estÃƒÂ¡ tentando resolver. c) Resuma as ÃƒÂ¡reas de acordo, e entÃƒÂ£o resolva as poucas discordÃƒÂ¢ncias. Deixe que as pessoas falem sobre suas hesitaÃƒÂ§ÃƒÂµes antes de continuar. d) Certifique-se de ambos os lados compreender claramente as divergÃƒÂªncias, em seguida, tome a iniciativa de propor soluÃƒÂ§ÃƒÂµes. e) Uma vez que seja alcanÃƒÂ§ado um acordo, resuma os benefÃƒÂ­cios para ambos os lados, para que todo mundo tenha um sentimentos positivos sobre o negÃƒÂ³cio.";;;;;;ACT;1;1
LearningActivity;9233;pt_BR;Leitura de 15 segundos. Formate o texto para que os leitores possam captar a ideia principal em uma rÃƒÂ¡pida olhada. Se eles gostam da ideia principal, eles lerÃƒÂ£o o resto.;9001;Leitura de 15 segundos. Formate o texto para que os leitores possam captar a ideia principal em uma rÃƒÂ¡pida olhada. Se eles gostam da ideia principal, eles lerÃƒÂ£o o resto.;;;;;;ACT;1;1
LearningActivity;9218;pt_BR;Seja direto. Use uma linguagem simples e direta. Evite termos tÃƒÂ©cnicos e siglas quando falar com as pessoas fora de sua ÃƒÂ¡rea de trabalho. Mantenha os seus comentÃƒÂ¡rios claros e evite detalhes irrelevantes.;9001;Seja direto. Use uma linguagem simples e direta. Evite termos tÃƒÂ©cnicos e siglas quando falar com as pessoas fora de sua ÃƒÂ¡rea de trabalho. Mantenha os seus comentÃƒÂ¡rios claros e evite detalhes irrelevantes.;;;;;;ACT;1;1
LearningActivity;9047;pt_BR;Priorize o desenvolvimento. Todos nÃƒÂ³s recebemos feedback de muitas fontes, por isso ÃƒÂ© importante priorizar. Mantenha uma lista das ÃƒÂ¡reas em que vocÃƒÂª gostaria de melhorar (ou foram feitas para melhorar). Revise periodicamente a lista com o seu gerente e colegas de trabalho para se certificar de que vocÃƒÂª esta se concentrando em questÃƒÂµes fundamentais.;9001;Priorize o desenvolvimento. Todos nÃƒÂ³s recebemos feedback de muitas fontes, por isso ÃƒÂ© importante priorizar. Mantenha uma lista das ÃƒÂ¡reas em que vocÃƒÂª gostaria de melhorar (ou foram feitas para melhorar). Revise periodicamente a lista com o seu gerente e colegas de trabalho para se certificar de que vocÃƒÂª esta se concentrando em questÃƒÂµes fundamentais.;;;;;;ACT;1;1
LearningActivity;9089;pt_BR;NÃƒÂ£o reinvente a roda. Procure saber o mÃƒÂ¡ximo que puder sobre como algo foi feito antes. Use as ideias existentes, juntamente com as suas prÃƒÂ³prias, para desenvolver uma nova abordagem. Ideias inovadoras nÃƒÂ£o significam necessariamente fazer algo que nÃƒÂ£o existia antes.;9001;NÃƒÂ£o reinvente a roda. Procure saber o mÃƒÂ¡ximo que puder sobre como algo foi feito antes. Use as ideias existentes, juntamente com as suas prÃƒÂ³prias, para desenvolver uma nova abordagem. Ideias inovadoras nÃƒÂ£o significam necessariamente fazer algo que nÃƒÂ£o existia antes.;;;;;;ACT;1;1
LearningActivity;9166;pt_BR;Recompense o esforÃƒÂ§o individual. Nem todo mundo valoriza as mesmas recompensas. Saiba o que motiva o seus empregados. Se ÃƒÂ© o reconhecimento pÃƒÂºblico, a lideranÃƒÂ§a de um projeto pode ser a chance de trabalhar com outras pessoas e departamento e assim aumentar a visibilidade. NÃƒÂ£o prometa mais do que vocÃƒÂª pode oferecer, mas seja criativo e claro.;9001;Recompense o esforÃƒÂ§o individual. Nem todo mundo valoriza as mesmas recompensas. Saiba o que motiva o seus empregados. Se ÃƒÂ© o reconhecimento pÃƒÂºblico, a lideranÃƒÂ§a de um projeto pode ser a chance de trabalhar com outras pessoas e departamento e assim aumentar a visibilidade. NÃƒÂ£o prometa mais do que vocÃƒÂª pode oferecer, mas seja criativo e claro.;;;;;;ACT;1;1
LearningActivity;9030;pt_BR;Valorize todas as opiniÃƒÂµes e posiÃƒÂ§ÃƒÂµes de sua equipe. Incentive e aceite todas as opiniÃƒÂµes, quer sejam provenientes de gestores ou de trabalhadores operacionais. Evite o aparecimento de favorecer determinados tipos de trabalho.;9001;Valorize todas as opiniÃƒÂµes e posiÃƒÂ§ÃƒÂµes de sua equipe. Incentive e aceite todas as opiniÃƒÂµes, quer sejam provenientes de gestores ou de trabalhadores operacionais. Evite o aparecimento de favorecer determinados tipos de trabalho.;;;;;;ACT;1;1
LearningActivity;9286;pt_BR;Voluntarie-se. Cadastre-se em um projeto que envolve uma tecnologia nova. Tente participar desde o inÃƒÂ­cio. Ajude a definir os requisitos de negÃƒÂ³cio e identificar as alternativas tecnolÃƒÂ³gicas relevantes, participe da equipe de avaliaÃƒÂ§ÃƒÂ£o e seleÃƒÂ§ÃƒÂ£o, e da implementaÃƒÂ§ÃƒÂ£o, se puder.;9001;Voluntarie-se. Cadastre-se em um projeto que envolve uma tecnologia nova. Tente participar desde o inÃƒÂ­cio. Ajude a definir os requisitos de negÃƒÂ³cio e identificar as alternativas tecnolÃƒÂ³gicas relevantes, participe da equipe de avaliaÃƒÂ§ÃƒÂ£o e seleÃƒÂ§ÃƒÂ£o, e da implementaÃƒÂ§ÃƒÂ£o, se puder.;;;;;;ACT;1;1
LearningActivity;9243;pt_BR;FaÃƒÂ§a uma lista de prioridades. Divida todas as coisas que vocÃƒÂª precisa fazer em trÃƒÂªs pilhas: urgente, precisa ser feito em breve, pode esperar. FaÃƒÂ§a os trabalhos sobre os itens urgentes, atÃƒÂ© terminar, e reavalie periodicamente o que estÃƒÂ¡ em cada pilha.;9001;FaÃƒÂ§a uma lista de prioridades. Divida todas as coisas que vocÃƒÂª precisa fazer em trÃƒÂªs pilhas: urgente, precisa ser feito em breve, pode esperar. FaÃƒÂ§a os trabalhos sobre os itens urgentes, atÃƒÂ© terminar, e reavalie periodicamente o que estÃƒÂ¡ em cada pilha.;;;;;;ACT;1;1
LearningActivity;9156;pt_BR;Comemore! Procure oportunidades nas quais os empregados possam receber algum reconhecimento. Por exemplo, permitir que pessoas que se destacam na ÃƒÂ¡rea tomem a frente de reuniÃƒÂµes ou projetos.;9001;Comemore! Procure oportunidades nas quais os empregados possam receber algum reconhecimento. Por exemplo, permitir que pessoas que se destacam na ÃƒÂ¡rea tomem a frente de reuniÃƒÂµes ou projetos.;;;;;;ACT;1;1
LearningActivity;9266;pt_BR;Comunique os problemas, mas tente uma soluÃƒÂ§ÃƒÂ£o em primeiro lugar. Quando possÃƒÂ­vel, elabore planos de aÃƒÂ§ÃƒÂ£o bÃƒÂ¡sicos para lidar com possÃƒÂ­veis problemas que vocÃƒÂª identificou. DÃƒÂª a si mesmo um cronograma conjunto para criar uma soluÃƒÂ§ÃƒÂ£o. Ao final desse prazo, comprometa-se a informar o seu gerente sobre o problema, independentemente se vocÃƒÂª jÃƒÂ¡ tem um plano definido.;9001;Comunique os problemas, mas tente uma soluÃƒÂ§ÃƒÂ£o em primeiro lugar. Quando possÃƒÂ­vel, elabore planos de aÃƒÂ§ÃƒÂ£o bÃƒÂ¡sicos para lidar com possÃƒÂ­veis problemas que vocÃƒÂª identificou. DÃƒÂª a si mesmo um cronograma conjunto para criar uma soluÃƒÂ§ÃƒÂ£o. Ao final desse prazo, comprometa-se a informar o seu gerente sobre o problema, independentemente se vocÃƒÂª jÃƒÂ¡ tem um plano definido.;;;;;;ACT;1;1
LearningActivity;9117;pt_BR;Aprenda com um negociador forte. Trabalhe com um colega que vocÃƒÂª acha que ÃƒÂ© um negociador forte. Anote  2 ou 3 coisas que vocÃƒÂª ache mais eficaz na concretizaÃƒÂ§ÃƒÂ£o de uma negociaÃƒÂ§ÃƒÂ£o bem sucedida. Pergunte ao seu par por que ele ou ela fez essas coisas. Aplique o que vocÃƒÂª aprendeu em suas negociaÃƒÂ§ÃƒÂµes.;9001;Aprenda com um negociador forte. Trabalhe com um colega que vocÃƒÂª acha que ÃƒÂ© um negociador forte. Anote  2 ou 3 coisas que vocÃƒÂª ache mais eficaz na concretizaÃƒÂ§ÃƒÂ£o de uma negociaÃƒÂ§ÃƒÂ£o bem sucedida. Pergunte ao seu par por que ele ou ela fez essas coisas. Aplique o que vocÃƒÂª aprendeu em suas negociaÃƒÂ§ÃƒÂµes.;;;;;;ACT;1;1
LearningActivity;9116;pt_BR;"Aprenda tÃƒÂ©cnicas de ponte. Forme uma ""ponte"" de um produto para outro, na hora da venda. Use esta ""ponte"" em declaraÃƒÂ§ÃƒÂµes como: ""Assim como o produto atendeu ÃƒÂ s suas necessidades no gerenciamento de dados, temos um outro produto que pode ajudÃƒÂ¡-lo."" Pratique estas declaraÃƒÂ§ÃƒÂµes atÃƒÂ© que vocÃƒÂª veja a resposta de seus clientes e que vocÃƒÂª se sinta confortÃƒÂ¡vel em usÃƒÂ¡-las.";9001;"Aprenda tÃƒÂ©cnicas de ponte. Forme uma ""ponte"" de um produto para outro, na hora da venda. Use esta ""ponte"" em declaraÃƒÂ§ÃƒÂµes como: ""Assim como o produto atendeu ÃƒÂ s suas necessidades no gerenciamento de dados, temos um outro produto que pode ajudÃƒÂ¡-lo."" Pratique estas declaraÃƒÂ§ÃƒÂµes atÃƒÂ© que vocÃƒÂª veja a resposta de seus clientes e que vocÃƒÂª se sinta confortÃƒÂ¡vel em usÃƒÂ¡-las.";;;;;;ACT;1;1
LearningActivity;9276;pt_BR;Sabia o que ÃƒÂ© possÃƒÂ­vel. Quase tudo o que fazemos no trabalho pode ser feito mais fÃƒÂ¡cil com a ajuda da web. ApresentaÃƒÂ§ÃƒÂµes, calendÃƒÂ¡rio, compartilhamento de arquivos, gerenciamento de reuniÃƒÂµes, pesquisa e muito mais, vocÃƒÂª consegue achar na internet atravÃƒÂ©s de diversos sites e aplicativos, muitos deles gratuitos ou de baixo custo. Se vocÃƒÂª tem uma tarefa contÃƒÂ­nua que precisa de um monte de tempo e esforÃƒÂ§o (por exemplo, a criaÃƒÂ§ÃƒÂ£o de reuniÃƒÂµes e gerenciamento de calendÃƒÂ¡rios de outros), pesquise na web ou peÃƒÂ§a a um colega de trabalho soluÃƒÂ§ÃƒÂµes de internet que podem ajudar.;9001;Sabia o que ÃƒÂ© possÃƒÂ­vel. Quase tudo o que fazemos no trabalho pode ser feito mais fÃƒÂ¡cil com a ajuda da web. ApresentaÃƒÂ§ÃƒÂµes, calendÃƒÂ¡rio, compartilhamento de arquivos, gerenciamento de reuniÃƒÂµes, pesquisa e muito mais, vocÃƒÂª consegue achar na internet atravÃƒÂ©s de diversos sites e aplicativos, muitos deles gratuitos ou de baixo custo. Se vocÃƒÂª tem uma tarefa contÃƒÂ­nua que precisa de um monte de tempo e esforÃƒÂ§o (por exemplo, a criaÃƒÂ§ÃƒÂ£o de reuniÃƒÂµes e gerenciamento de calendÃƒÂ¡rios de outros), pesquise na web ou peÃƒÂ§a a um colega de trabalho soluÃƒÂ§ÃƒÂµes de internet que podem ajudar.;;;;;;ACT;1;1
LearningActivity;9201;pt_BR;"OuÃƒÂ§a a toda a resposta. Isto inclui: manter sua mente e ouvidos abertos (se concentrar no que a pessoa estÃƒÂ¡ dizendo e nÃƒÂ£o no que vocÃƒÂª estÃƒÂ¡ pensando ou planejando) falar (nÃƒÂ£o interrompa usando ""conte-me mais"", faÃƒÂ§a perguntas para esclarecer algo mal entendido) mantenha contato visual, use expressÃƒÂµes faciais e gestos para mostrar que vocÃƒÂª estÃƒÂ¡ ouvindo (ouÃƒÂ§a a pessoa sem reaÃƒÂ§ÃƒÂµes rÃƒÂ¡pidas , ou seja nÃƒÂ£o comente diretamente o que a pessoa acabou de dizer).";9001;"OuÃƒÂ§a a toda a resposta. Isto inclui: manter sua mente e ouvidos abertos (se concentrar no que a pessoa estÃƒÂ¡ dizendo e nÃƒÂ£o no que vocÃƒÂª estÃƒÂ¡ pensando ou planejando) falar (nÃƒÂ£o interrompa usando ""conte-me mais"", faÃƒÂ§a perguntas para esclarecer algo mal entendido) mantenha contato visual, use expressÃƒÂµes faciais e gestos para mostrar que vocÃƒÂª estÃƒÂ¡ ouvindo (ouÃƒÂ§a a pessoa sem reaÃƒÂ§ÃƒÂµes rÃƒÂ¡pidas , ou seja nÃƒÂ£o comente diretamente o que a pessoa acabou de dizer).";;;;;;ACT;1;1
LearningActivity;9238;pt_BR;Mantenha um objetivo em mente. Quando vocÃƒÂª estÃƒÂ¡ sob pressÃƒÂ£o e tem que tomar uma decisÃƒÂ£o, mantenha o seu objetivo mais crÃƒÂ­tico em mente. Anote-o em um pedaÃƒÂ§o de papel e deixe em sua mesa, de modo que todas as decisÃƒÂµes que vocÃƒÂª fizer, esse objetivo seja levado em consideraÃƒÂ§ÃƒÂ£o.;9001;Mantenha um objetivo em mente. Quando vocÃƒÂª estÃƒÂ¡ sob pressÃƒÂ£o e tem que tomar uma decisÃƒÂ£o, mantenha o seu objetivo mais crÃƒÂ­tico em mente. Anote-o em um pedaÃƒÂ§o de papel e deixe em sua mesa, de modo que todas as decisÃƒÂµes que vocÃƒÂª fizer, esse objetivo seja levado em consideraÃƒÂ§ÃƒÂ£o.;;;;;;ACT;1;1
LearningActivity;9026;pt_BR;Trabalhe em equipe para chegar mais longe. Procure oportunidades de cooperaÃƒÂ§ÃƒÂ£o com outras pessoas e departamentos, ao igualar as competÃƒÂªncias aumentamos a velocidade e o impacto no trabalho. NÃƒÂ£o tenha medo de fazer o primeiro investimento em um relacionamento mutuamente benÃƒÂ©fico. Desenvolva uma reputaÃƒÂ§ÃƒÂ£o de trabalho em equipe, especialmente com aqueles que podem ajudÃƒÂ¡-lo a ter sucesso.;9001;Trabalhe em equipe para chegar mais longe. Procure oportunidades de cooperaÃƒÂ§ÃƒÂ£o com outras pessoas e departamentos, ao igualar as competÃƒÂªncias aumentamos a velocidade e o impacto no trabalho. NÃƒÂ£o tenha medo de fazer o primeiro investimento em um relacionamento mutuamente benÃƒÂ©fico. Desenvolva uma reputaÃƒÂ§ÃƒÂ£o de trabalho em equipe, especialmente com aqueles que podem ajudÃƒÂ¡-lo a ter sucesso.;;;;;;ACT;1;1
LearningActivity;9250;pt_BR;Plano e cronograma realistas. A falta de planejamento e programaÃƒÂ§ÃƒÂ£o pode aumentar os custos de horas extras e o preÃƒÂ§o dos materiais e transporte. Passe o tempo que for necessÃƒÂ¡rio no inÃƒÂ­cio de um projeto para assegurar, dentro do que ÃƒÂ© factÃƒÂ­vel, um cronograma de produÃƒÂ§ÃƒÂ£o realista.;9001;Plano e cronograma realistas. A falta de planejamento e programaÃƒÂ§ÃƒÂ£o pode aumentar os custos de horas extras e o preÃƒÂ§o dos materiais e transporte. Passe o tempo que for necessÃƒÂ¡rio no inÃƒÂ­cio de um projeto para assegurar, dentro do que ÃƒÂ© factÃƒÂ­vel, um cronograma de produÃƒÂ§ÃƒÂ£o realista.;;;;;;ACT;1;1
LearningActivity;9009;pt_BR;Seja pessoal. ConheÃƒÂ§a seus colegas de trabalho em um nÃƒÂ­vel mais pessoal. Procure por interesses comuns fora do trabalho, especialmente com pessoas com as quais vocÃƒÂª tem algum conflito.;9001;Seja pessoal. ConheÃƒÂ§a seus colegas de trabalho em um nÃƒÂ­vel mais pessoal. Procure por interesses comuns fora do trabalho, especialmente com pessoas com as quais vocÃƒÂª tem algum conflito.;;;;;;ACT;1;1
LearningActivity;9136;pt_BR;Prepare-se com antecedÃƒÂªncia. Um plano de negociaÃƒÂ§ÃƒÂ£o ou estratÃƒÂ©gia deve ser pesquisado, preparado e testado com antecedÃƒÂªncia. Esta preparaÃƒÂ§ÃƒÂ£o inclui: a) Pesquisar as necessidades do cliente, interesses, opiniÃƒÂµes e oportunidades. b) CompreensÃƒÂ£o crÃƒÂ­tica antecipada sobre a posiÃƒÂ§ÃƒÂ£o de sua empresa e interesses. c) Experimentar e testar a estratÃƒÂ©gia. d) Escolher um clima favorÃƒÂ¡vel para as negociaÃƒÂ§ÃƒÂµes.;9001;Prepare-se com antecedÃƒÂªncia. Um plano de negociaÃƒÂ§ÃƒÂ£o ou estratÃƒÂ©gia deve ser pesquisado, preparado e testado com antecedÃƒÂªncia. Esta preparaÃƒÂ§ÃƒÂ£o inclui: a) Pesquisar as necessidades do cliente, interesses, opiniÃƒÂµes e oportunidades. b) CompreensÃƒÂ£o crÃƒÂ­tica antecipada sobre a posiÃƒÂ§ÃƒÂ£o de sua empresa e interesses. c) Experimentar e testar a estratÃƒÂ©gia. d) Escolher um clima favorÃƒÂ¡vel para as negociaÃƒÂ§ÃƒÂµes.;;;;;;ACT;1;1
LearningActivity;9208;pt_BR;Solicite ideias da equipe. Incentive comentÃƒÂ¡rios e sugestÃƒÂµes sobre procedimentos do projeto. Implemente as melhores sugestÃƒÂµes para demonstrar o valor da opiniÃƒÂ£o.;9001;Solicite ideias da equipe. Incentive comentÃƒÂ¡rios e sugestÃƒÂµes sobre procedimentos do projeto. Implemente as melhores sugestÃƒÂµes para demonstrar o valor da opiniÃƒÂ£o.;;;;;;ACT;1;1
LearningActivity;9212;pt_BR;"Aguarde alguns minutos antes de responder a alguÃƒÂ©m. Quando alguÃƒÂ©m diz algo para vocÃƒÂª, pergunte a si mesmo: ""O que essa pessoa realmente quis dizer?"" Se vocÃƒÂª nÃƒÂ£o tiver certeza, peÃƒÂ§a esclarecimentos antes de responder.";9001;"Aguarde alguns minutos antes de responder a alguÃƒÂ©m. Quando alguÃƒÂ©m diz algo para vocÃƒÂª, pergunte a si mesmo: ""O que essa pessoa realmente quis dizer?"" Se vocÃƒÂª nÃƒÂ£o tiver certeza, peÃƒÂ§a esclarecimentos antes de responder.";;;;;;ACT;1;1
LearningActivity;9280;pt_BR;Assuma a responsabilidade pelo processo orÃƒÂ§amentÃƒÂ¡rio. A sua contribuiÃƒÂ§ÃƒÂ£o para o processo de orÃƒÂ§amento ÃƒÂ© importante para a organizaÃƒÂ§ÃƒÂ£o. Use sua experiÃƒÂªncia para identificar os itens orÃƒÂ§amentÃƒÂ¡rios que sÃƒÂ£o propensos a derrapagens de custos e itens que poderiam ser simplificados, sem comprometer os objetivos organizacionais.;9001;Assuma a responsabilidade pelo processo orÃƒÂ§amentÃƒÂ¡rio. A sua contribuiÃƒÂ§ÃƒÂ£o para o processo de orÃƒÂ§amento ÃƒÂ© importante para a organizaÃƒÂ§ÃƒÂ£o. Use sua experiÃƒÂªncia para identificar os itens orÃƒÂ§amentÃƒÂ¡rios que sÃƒÂ£o propensos a derrapagens de custos e itens que poderiam ser simplificados, sem comprometer os objetivos organizacionais.;;;;;;ACT;1;1
LearningActivity;9125;pt_BR;Mantenha o conhecimento profissional e tÃƒÂ©cnico. Leia regularmente artigos tÃƒÂ©cnicos que se aplicam ao seu trabalho. Busque participar de feiras para descobrir informaÃƒÂ§ÃƒÂµes relevantes sobre as prÃƒÂ¡ticas atuais e as novas tecnologias.;9001;Mantenha o conhecimento profissional e tÃƒÂ©cnico. Leia regularmente artigos tÃƒÂ©cnicos que se aplicam ao seu trabalho. Busque participar de feiras para descobrir informaÃƒÂ§ÃƒÂµes relevantes sobre as prÃƒÂ¡ticas atuais e as novas tecnologias.;;;;;;ACT;1;1
LearningActivity;9087;pt_BR;Resumo do produto concorrente. A partir do seu programa de estudo, desenvolva para cada produto um resumo do produto concorrente, listando caracterÃƒÂ­sticas e benefÃƒÂ­cios, preÃƒÂ§o e outras comparaÃƒÂ§ÃƒÂµes. Mantenha um arquivo ou uma pasta para essas referÃƒÂªncias. Partilhe o seu trabalho com o seu gerente e colegas.;9001;Resumo do produto concorrente. A partir do seu programa de estudo, desenvolva para cada produto um resumo do produto concorrente, listando caracterÃƒÂ­sticas e benefÃƒÂ­cios, preÃƒÂ§o e outras comparaÃƒÂ§ÃƒÂµes. Mantenha um arquivo ou uma pasta para essas referÃƒÂªncias. Partilhe o seu trabalho com o seu gerente e colegas.;;;;;;ACT;1;1
LearningActivity;9046;pt_BR;Olhe para as suas forÃƒÂ§as e fraquezas. A capacidade de olhar para as suas prÃƒÂ³prias atitudes e interesses ÃƒÂ© essencial para a gestÃƒÂ£o de uma forÃƒÂ§a de trabalho diversificada. Gerentes eficazes compreendem as suas prÃƒÂ³prias forÃƒÂ§as, fraquezas e preconceitos e eles sabem como o seu ponto de vista pessoal afeta a sua interaÃƒÂ§ÃƒÂ£o com as pessoas que sÃƒÂ£o diferentes. Escolha um colega para reunir-se regularmente, e que tambÃƒÂ©m pretende gerenciar com mais sensibilidade suas diferenÃƒÂ§as. Compartilhe objetivos, defina metas, e relate o progresso.;9001;Olhe para as suas forÃƒÂ§as e fraquezas. A capacidade de olhar para as suas prÃƒÂ³prias atitudes e interesses ÃƒÂ© essencial para a gestÃƒÂ£o de uma forÃƒÂ§a de trabalho diversificada. Gerentes eficazes compreendem as suas prÃƒÂ³prias forÃƒÂ§as, fraquezas e preconceitos e eles sabem como o seu ponto de vista pessoal afeta a sua interaÃƒÂ§ÃƒÂ£o com as pessoas que sÃƒÂ£o diferentes. Escolha um colega para reunir-se regularmente, e que tambÃƒÂ©m pretende gerenciar com mais sensibilidade suas diferenÃƒÂ§as. Compartilhe objetivos, defina metas, e relate o progresso.;;;;;;ACT;1;1
LearningActivity;9274;pt_BR;Verifique o seu trabalho. FaÃƒÂ§a um esforÃƒÂ§o consciente para verificar suas metas organizacionais. Mantenha esta verificaÃƒÂ§ÃƒÂ£o dos planos para garantir que eles continuem a apoiar mudanÃƒÂ§as de interesses organizacionais de longo prazo.;9001;Verifique o seu trabalho. FaÃƒÂ§a um esforÃƒÂ§o consciente para verificar suas metas organizacionais. Mantenha esta verificaÃƒÂ§ÃƒÂ£o dos planos para garantir que eles continuem a apoiar mudanÃƒÂ§as de interesses organizacionais de longo prazo.;;;;;;ACT;1;1
LearningActivity;9127;pt_BR;Coaching como parte do trabalho. Compartilhe com seus empregados de lideranÃƒÂ§a a importÃƒÂ¢ncia de fazer coaching com suas equipes. Certifique-se de que eles entendem que o tempo gasto para treinar a equipe ÃƒÂ© uma de suas responsabilidades e que vocÃƒÂª irÃƒÂ¡ valoriza-los por isso.;9001;Coaching como parte do trabalho. Compartilhe com seus empregados de lideranÃƒÂ§a a importÃƒÂ¢ncia de fazer coaching com suas equipes. Certifique-se de que eles entendem que o tempo gasto para treinar a equipe ÃƒÂ© uma de suas responsabilidades e que vocÃƒÂª irÃƒÂ¡ valoriza-los por isso.;;;;;;ACT;1;1
LearningActivity;9090;pt_BR;EstabeleÃƒÂ§a um sistema de benchmarking. Identifique as melhores prÃƒÂ¡ticas da indÃƒÂºstria e estabeleÃƒÂ§a metas para a empresa. Determine onde a empresa ÃƒÂ© lÃƒÂ­der na indÃƒÂºstria, e onde ele precisa ser melhorado.;9001;EstabeleÃƒÂ§a um sistema de benchmarking. Identifique as melhores prÃƒÂ¡ticas da indÃƒÂºstria e estabeleÃƒÂ§a metas para a empresa. Determine onde a empresa ÃƒÂ© lÃƒÂ­der na indÃƒÂºstria, e onde ele precisa ser melhorado.;;;;;;ACT;1;1
LearningActivity;9258;pt_BR;Apoie o seu direcionamento estratÃƒÂ©gico. Consulte com frequÃƒÂªncia seu plano de marketing para verificar se continua orientado ÃƒÂ  estratÃƒÂ©gica geral.;9001;Apoie o seu direcionamento estratÃƒÂ©gico. Consulte com frequÃƒÂªncia seu plano de marketing para verificar se continua orientado ÃƒÂ  estratÃƒÂ©gica geral.;;;;;;ACT;1;1
LearningActivity;9078;pt_BR;Verifique o ritmo. Em determinadas regiÃƒÂµes ou culturas, tudo sobre negÃƒÂ³cios em que ser direto ao ponto. Em outros lugares, as relaÃƒÂ§ÃƒÂµes pessoais e outros intangÃƒÂ­veis podem ser falados antes da reuniÃƒÂ£o. Saiba onde vocÃƒÂª estÃƒÂ¡ indo e qual o estilo predominante daquela cultura. Em seguida, adapte o seu ritmo.;9001;Verifique o ritmo. Em determinadas regiÃƒÂµes ou culturas, tudo sobre negÃƒÂ³cios em que ser direto ao ponto. Em outros lugares, as relaÃƒÂ§ÃƒÂµes pessoais e outros intangÃƒÂ­veis podem ser falados antes da reuniÃƒÂ£o. Saiba onde vocÃƒÂª estÃƒÂ¡ indo e qual o estilo predominante daquela cultura. Em seguida, adapte o seu ritmo.;;;;;;ACT;1;1
LearningActivity;9013;pt_BR;Envolvimento das partes interessadas e fornecedores. Fique atento a pessoas que tÃƒÂªm interesse e que possam contribuir com seu projeto. Contate com antecedÃƒÂªncia as pessoas que vocÃƒÂª vai precisar que entreguem demandas o mais rapidamente possÃƒÂ­vel. DÃƒÂª-lhes tempo para entregar o melhor do que vocÃƒÂª precisa.;9001;Envolvimento das partes interessadas e fornecedores. Fique atento a pessoas que tÃƒÂªm interesse e que possam contribuir com seu projeto. Contate com antecedÃƒÂªncia as pessoas que vocÃƒÂª vai precisar que entreguem demandas o mais rapidamente possÃƒÂ­vel. DÃƒÂª-lhes tempo para entregar o melhor do que vocÃƒÂª precisa.;;;;;;ACT;1;1
LearningActivity;9267;pt_BR;Crie o trabalho que vocÃƒÂª deseja. Esteja ÃƒÂ  procura de oportunidades de usar e expandir as habilidades que vocÃƒÂª mais gosta de usar. Se vocÃƒÂª ver um novo projeto que se encaixa no seu projeto, peÃƒÂ§a para trabalhar nele.;9001;Crie o trabalho que vocÃƒÂª deseja. Esteja ÃƒÂ  procura de oportunidades de usar e expandir as habilidades que vocÃƒÂª mais gosta de usar. Se vocÃƒÂª ver um novo projeto que se encaixa no seu projeto, peÃƒÂ§a para trabalhar nele.;;;;;;ACT;1;1
