ENTRY_TYPE;GUID;LOCALE;ENTRY_NAME;PARENT_ENTRY_ID;FIELD1;FIELD2;FIELD3;FIELD4;FIELD5;FIELD6;ACTIVITY;ACTIVE;EDITABLE
LACatalog;9001;pt_BR;Atividade de Aprendizagem;;;;;;;;;;
LearningActivity;9022;pt_BR;Aumente seus contatos. Faça mais contatos fora de sua área ou negócios. Procure por um feedback verdadeiramente diversificado. Consulte especialistas técnicos para adicionar detalhes em seus planos de contingência. Além disso, converse com várias pessoas para obter uma visão geral.;9001;Aumente seus contatos. Faça mais contatos fora de sua área ou negócios. Procure por um feedback verdadeiramente diversificado. Consulte especialistas técnicos para adicionar detalhes em seus planos de contingência. Além disso; converse com várias pessoas para obter uma visão geral.;;;;;ACT;1;1
LearningActivity;9152;pt_BR;Vender as necessidades. Envolva-se em um programa de treinamento de habilidades de vendas intensivo ou em um programa de auto estudo que aborda todas as fases de necessidades de venda, ou seja, a necessidade de identificaÃƒÂ§ÃƒÂ£o, de desenvolvimento, de reconhecimento, criaÃƒÂ§ÃƒÂ£o de apresentaÃƒÂ§ÃƒÂµes em torno das necessidades dos clientes, e fechando com base nas necessidades.;9001;Vender as necessidades. Envolva-se em um programa de treinamento de habilidades de vendas intensivo ou em um programa de auto estudo que aborda todas as fases de necessidades de venda, ou seja, a necessidade de identificaÃƒÂ§ÃƒÂ£o, de desenvolvimento, de reconhecimento, criaÃƒÂ§ÃƒÂ£o de apresentaÃƒÂ§ÃƒÂµes em torno das necessidades dos clientes, e fechando com base nas necessidades.;;;;;;ACT;1;1
LearningActivity;9176;pt_BR;Construa confiança. Discuta os projetos bem sucedidos nos quais seus empregados têm trabalhado. Mostre-lhes que eles tem capacidade para lidar com suas responsabilidades. Equilibre a crítica construtiva com o reconhecimento de realizações específicas.;9001;Construa confianÃƒÂ§a. Discuta os projetos bem sucedidos nos quais seus empregados tÃƒÂªm trabalhado. Mostre-lhes que eles tÃƒÂªm capacidade para lidar com suas responsabilidades. Equilibre a crÃƒÂ­tica construtiva com o reconhecimento de realizaÃƒÂ§ÃƒÂµes especÃƒÂ­ficas.;;;;;;ACT;1;1
LearningActivity;9138;pt_BR;"Reserve tempo para o pensar sobre a estratégia e planejamento. Você nem sempre tem que estar ""fazendo"" alguma coisa para a área funcionar. Marque o tempo para estratégia no seu calendário e trate-o como qualquer outro compromisso ou reuniÃ£o. Resista à  tentação de gastar este tempo com outras coisas.";9001;"Reserve tempo para o pensar sobre a estratÃƒÂ©gia e planejamento. VocÃƒÂª nem sempre tem que estar ""fazendo"" alguma coisa para a ÃƒÂ¡rea funcionar. Marque o tempo para estratÃƒÂ©gia no seu calendÃƒÂ¡rio e trate-o como qualquer outro compromisso ou reuniÃƒÂ£o. Resista ÃƒÂ  tentaÃƒÂ§ÃƒÂ£o de gastar este tempo com outras coisas.";;;;;;ACT;1;1
LearningActivity;9167;pt_BR;Recompense decisões difíceis. Configure recompensas claras quando alguém assumir o comando. Ofereça algo óbvio: elogios públicos ou uma nova missão.;9001;Recompense decisÃƒÂµes difÃƒÂ­ceis. Configure recompensas claras quando alguÃƒÂ©m assumir o comando. OfereÃƒÂ§a algo ÃƒÂ³bvio: elogios pÃƒÂºblicos ou uma nova missÃƒÂ£o.;;;;;;ACT;1;1
LearningActivity;9206;pt_BR;Compartilhe a responsabilidade pelos resultados. Compartilhe a responsabilidade por todos os resultados. Se o resultado é bom, compartilhe os elogios e recompensas. Se o resultado é ruim, deixe as pessoas saberem quais são as consequências e como eles podem melhorar para o futuro.;9001;Compartilhe a responsabilidade pelos resultados. Compartilhe a responsabilidade por todos os resultados. Se o resultado ÃƒÂ© bom, compartilhe os elogios e recompensas. Se o resultado ÃƒÂ© ruim, deixe as pessoas saberem quais sÃƒÂ£o as consequÃƒÂªncias e como eles podem melhorar para o futuro.;;;;;;ACT;1;1
LearningActivity;9151;pt_BR;Pense fora da caixa. Durante uma pausa, dê uma olhada nos pontos de atrito e, sozinho ou com membros da equipe, debata uma abordagem totalmente nova para lidar com eles. Isso, muitas vezes, será mais ácil se você convidar alguém que já viveu o atrito ou situação parecida.;9001;Pense fora da caixa. Durante uma pausa, dÃƒÂª uma olhada nos pontos de atrito e, sozinho ou com membros da equipe, debata uma abordagem totalmente nova para lidar com eles. Isso, muitas vezes, serÃƒÂ¡ mais fÃƒÂ¡cil se vocÃƒÂª convidar alguÃƒÂ©m que jÃƒÂ¡ viveu o atrito ou situaÃƒÂ§ÃƒÂ£o parecida.;;;;;;ACT;1;1
LearningActivity;9130;pt_BR;Certifique-se que as expectativas do cliente estão claras. Reveja as suas expectativas sobre o atendimento de qualidade e, aponte ações específicas. Procure saber o que seu empregado fez ou deixou de fazer em prol dos objetivos de atendimento ao cliente. Diga a ele as maneiras que outros representantes têm trabalhado e fale sobre os resultados positivos desses esforços.;9001;Certifique-se que as expectativas do cliente estÃƒÂ£o claras. Reveja as suas expectativas sobre o atendimento de qualidade e, aponte aÃƒÂ§ÃƒÂµes especÃƒÂ­ficas. Procure saber o que seu empregado fez ou deixou de fazer em prol dos objetivos de atendimento ao cliente. Diga a ele as maneiras que outros representantes tÃƒÂªm trabalhado e fale sobre os resultados positivos desses esforÃƒÂ§os.;;;;;;ACT;1;1
LearningActivity;9197;pt_BR;Mantenha os outros informados sobre o seu progresso. Deixe colegas de trabalho saberem o que você está fazendo com a sua tarefa. Seus relatórios podem ajudar os outros a completar algum trabalho.;9001;Mantenha os outros informados sobre o seu progresso. Deixe colegas de trabalho saberem o que vocÃƒÂª estÃƒÂ¡ fazendo com a sua tarefa. Seus relatÃƒÂ³rios podem ajudar os outros a completar algum trabalho.;;;;;;ACT;1;1
LearningActivity;9255;pt_BR;Defina limites de tempo para as tarefas de rotina ou de baixa prioridade. Pare de trabalhar quando estiver trabalhando muitas horas por dia. Volte para estas tarefas apenas se você pÃ´de terminar itens de maior prioridade.;9001;Defina limites de tempo para as tarefas de rotina ou de baixa prioridade. Pare de trabalhar quando estiver trabalhando muitas horas por dia. Volte para estas tarefas apenas se vocÃƒÂª pÃƒÂ´de terminar itens de maior prioridade.;;;;;;ACT;1;1
LearningActivity;9231;pt_BR;Concentre-se em um objetivo. Quando há pouco tempo para reunir informações, concentre-se na realização de um objetivo.;9001;Concentre-se em um objetivo. Quando hÃƒÂ¡ pouco tempo para reunir informaÃƒÂ§ÃƒÂµes, concentre-se na realizaÃƒÂ§ÃƒÂ£o de um objetivo.;;;;;;ACT;1;1
LearningActivity;9278;pt_BR;Estude todos os produtos. Passe por toda a sua linha de produtos e combine duas ou trás vantagens para o cliente, para cada característica do produto. Então comece a corresponder às necessidades dos clientes a partir dos benefícios do produto. Grave a sua pesquisa em seus registros de clientes.;9001;Estude todos os produtos. Passe por toda a sua linha de produtos e combine duas ou trÃƒÂªs vantagens para o cliente, para cada caracterÃƒÂ­stica do produto. EntÃƒÂ£o comece a corresponder ÃƒÂ s necessidades dos clientes a partir dos benefÃƒÂ­cios do produto. Grave a sua pesquisa em seus registros de clientes.;;;;;;ACT;1;1
LearningActivity;9095;pt_BR;"Acompanhamento. Use um sistema para manter o controle das tarefas em andamento. Use listas de ""to do"", defina metas, escreva em seu calendá¡rio, faça um cronograma para reuniões de status, e use gerenciamento de informações pessoais ou software de gerenciamento de contatos. Use qualquer sistema que funcione para você. Seja responsável.";9001;"Acompanhamento. Use um sistema para manter o controle das tarefas em andamento. Use listas de ""to do"", defina metas, escreva em seu calendÃƒÂ¡rio, faÃƒÂ§a um cronograma para reuniÃƒÂµes de status, e use gerenciamento de informaÃƒÂ§ÃƒÂµes pessoais ou software de gerenciamento de contatos. Use qualquer sistema que funcione para vocÃƒÂª. Seja responsÃƒÂ¡vel.";;;;;;ACT;1;1
LearningActivity;9082;pt_BR;Gestão de orçamento. Consulte colegas de trabalho que se destacam no acompanhamento do orçamento. Aplique as melhores práticas deste colega para o seu próprio processo de melhoria nesta gestão.;9001;GestÃƒÂ£o de orÃƒÂ§amento. Consulte colegas de trabalho que se destacam no acompanhamento do orÃƒÂ§amento. Aplique as melhores prÃƒÂ¡ticas deste colega para o seu prÃƒÂ³prio processo de melhoria nesta gestÃƒÂ£o.;;;;;;ACT;1;1
LearningActivity;9012;pt_BR;Contato com o cliente (para gestor). Faça eventos regulares para conectar a sua equipe com o cliente. Peça-lhes para trabalhar no atendimento ao cliente por um dia ou ir em uma visita com um vendedor. Estabeleça um número mínimo de contatos aceitáveis de clientes por semana.;9001;Contato com o cliente (para gestor). FaÃƒÂ§a eventos regulares para conectar a sua equipe com o cliente. PeÃƒÂ§a-lhes para trabalhar no atendimento ao cliente por um dia ou ir em uma visita com um vendedor. EstabeleÃƒÂ§a um nÃƒÂºmero mÃƒÂ­nimo de contatos aceitÃƒÂ¡veis de clientes por semana.;;;;;;ACT;1;1
LearningActivity;9168;pt_BR;Consulte ativamente o seu gerente. Peça conselhos ao seu gerente sobre questões de comunicação sensíveis, especialmente se envolver outros departamentos.;9001;Consulte ativamente o seu gerente. PeÃƒÂ§a conselhos ao seu gerente sobre questÃƒÂµes de comunicaÃƒÂ§ÃƒÂ£o sensÃƒÂ­veis, especialmente se envolver outros departamentos.;;;;;;ACT;1;1
LearningActivity;9086;pt_BR;Custo de oportunidade dos recursos. Descreva um determinado recurso, aplicável a uma série de projetos. Ressalte outros projetos que poderiam ter sido concluídos com recursos desperdiçados em um projeto anterior.;9001;Custo de oportunidade dos recursos. Descreva um determinado recurso, aplicÃƒÂ¡vel a uma sÃƒÂ©rie de projetos. Ressalte outros projetos que poderiam ter sido concluÃƒÂ­dos com recursos desperdiÃƒÂ§ados em um projeto anterior.;;;;;;ACT;1;1
LearningActivity;9108;pt_BR;Aumente a sua compreensão. Melhore a sua compreensão dos fatores que impulsionam custos. Dedique um determinado número de horas por semana para a leitura de um jornal de negócios, revista, jornal regular, ou assistindo a um programa de televisão que explica as tendências econômicas que poderiam afetar a indústria.;9001;Aumente a sua compreensÃƒÂ£o. Melhore a sua compreensÃƒÂ£o dos fatores que impulsionam custos. Dedique um determinado nÃƒÂºmero de horas por semana para a leitura de um jornal de negÃƒÂ³cios, revista, jornal regular, ou assistindo a um programa de televisÃƒÂ£o que explica as tendÃƒÂªncias econÃƒÂ´micas que poderiam afetar a indÃƒÂºstria.;;;;;;ACT;1;1
LearningActivity;9189;pt_BR;Obtenha feedback inicial. Consulte os tomadores de decisões importantes e outros, no início do processo de planejamento para poupar tempo e agregar qualidade aos seus projetos. Estes pontos de vista podem ajudar a evitar problemas e prever a quantidade ideal de tempo e recursos necessários para atingir os objetivos.;9001;Obtenha feedback inicial. Consulte os tomadores de decisÃƒÂµes importantes e outros, no inÃƒÂ­cio do processo de planejamento para poupar tempo e agregar qualidade aos seus projetos. Estes pontos de vista podem ajudar a evitar problemas e prever a quantidade ideal de tempo e recursos necessÃƒÂ¡rios para atingir os objetivos.;;;;;;ACT;1;1
LearningActivity;9207;pt_BR;Compartilhe sua visão. Permita que sua equipe sabe saiba seus objetivos e visão de longo prazo. Sua equipe terá dificuldades de definir as prioridades globais e individuais, sem este direcionamento.;9001;Compartilhe sua visÃƒÂ£o. Permita que sua equipe sabe saiba seus objetivos e visÃƒÂ£o de longo prazo. Sua equipe terÃƒÂ¡ dificuldades de definir as prioridades globais e individuais, sem este direcionamento.;;;;;;ACT;1;1
LearningActivity;9123;pt_BR;Procure oportunidades de formação. Mantenha-se atento para as sessões de formação, seminários, conferências e outros eventos onde você pode enviar funcionários para aprender sobre como lidar com questões de qualidade.;9001;Procure oportunidades de formaÃƒÂ§ÃƒÂ£o. Mantenha-se atento para as sessÃƒÂµes de formaÃƒÂ§ÃƒÂ£o, seminÃƒÂ¡rios, conferÃƒÂªncias e outros eventos onde vocÃƒÂª pode enviar funcionÃƒÂ¡rios para aprender sobre como lidar com questÃƒÂµes de qualidade.;;;;;;ACT;1;1
LearningActivity;9035;pt_BR;Ensine sobre o básico. Estresse coerência, justiça, serviço e confiabilidade.;9001;Ensine sobre o bÃƒÂ¡sico. Estresse coerÃƒÂªncia, justiÃƒÂ§a, serviÃƒÂ§o e confiabilidade.;;;;;;ACT;1;1
LearningActivity;9171;pt_BR;Peça feedback e responder a ele. Converse com clientes, colegas e seu gerente para descobrir o quão bem você está usando suas habilidades atualmente. Olhe para seus resultados suas avaliações passadas. Procure por temas consistentes. Identifique quais habilidades estão trabalhando para você e quais não estão. Esta informação irá permitir-lhe continuar a fazer as coisas que você já está fazendo bem, e desenvolver um plano para melhorar suas habilidades, quando necessário.;9001;PeÃƒÂ§a feedback e responder a ele. Converse com clientes, colegas e seu gerente para descobrir o quÃƒÂ£o bem vocÃƒÂª estÃƒÂ¡ usando suas habilidades atualmente. Olhe para seus resultados suas avaliaÃƒÂ§ÃƒÂµes passadas. Procure por temas consistentes. Identifique quais habilidades estÃƒÂ£o trabalhando para vocÃƒÂª e quais nÃƒÂ£o estÃƒÂ£o. Esta informaÃƒÂ§ÃƒÂ£o irÃƒÂ¡ permitir-lhe continuar a fazer as coisas que vocÃƒÂª jÃƒÂ¡ estÃƒÂ¡ fazendo bem, e desenvolver um plano para melhorar suas habilidades, quando necessÃƒÂ¡rio.;;;;;;ACT;1;1
LearningActivity;9103;pt_BR;Oportunidades de expansão. a) Determine o potencial de seus clientes atuais. Use dados históricos de vendas, seu conhecimento de clientes, e os dados de pesquisa de mercado disponíveis para definir o potencial de vendas para cada uma das contas. Atribua prioridades de aumento para cada conta, ou seja, alto, médio, baixo potencial. b) Faça network entre a sua base de clientes atuais e novos contatos. Use seus contatos atuais para identificar outros novos, com necessidades de produtos diferentes do que aqueles que você têm vendido. c) Tenha um mentor. Gire através de vários departamentos, vendo o que eles fazem e como seus produtos podem caber em suas operações.;9001;Oportunidades de expansÃƒÂ£o. a) Determine o potencial de seus clientes atuais. Use dados histÃƒÂ³ricos de vendas, seu conhecimento de clientes, e os dados de pesquisa de mercado disponÃƒÂ­veis para definir o potencial de vendas para cada uma das contas. Atribua prioridades de aumento para cada conta, ou seja, alto, mÃƒÂ©dio, baixo potencial. b) FaÃƒÂ§a network entre a sua base de clientes atuais e novos contatos. Use seus contatos atuais para identificar outros novos, com necessidades de produtos diferentes do que aqueles que vocÃƒÂª tÃƒÂªm vendido. c) Tenha um mentor. Gire atravÃƒÂ©s de vÃƒÂ¡rios departamentos, vendo o que eles fazem e como seus produtos podem caber em suas operaÃƒÂ§ÃƒÂµes.;;;;;;ACT;1;1
LearningActivity;9006;pt_BR;Colaboração entre equipes. Trabalhe com outros gerentes para explorar oportunidades de colaboração entre as equipes. Os funcionários geralmente apreciam a exposição a novos campos e, ficam mais entusiasmos com a empresa como um todo.;9001;ColaboraÃƒÂ§ÃƒÂ£o entre equipes. Trabalhe com outros gerentes para explorar oportunidades de colaboraÃƒÂ§ÃƒÂ£o entre as equipes. Os funcionÃƒÂ¡rios geralmente apreciam a exposiÃƒÂ§ÃƒÂ£o a novos campos e, ficam mais entusiasmos com a empresa como um todo.;;;;;;ACT;1;1
LearningActivity;9037;pt_BR;Equipes de qualidade. Coloque pessoas chave juntas para resolver problemas de qualidade em sua área. Coloque a pessoa que identificou o problema no comando do grupo, e recompense essa pessoa para o esforço extra e quando a solução que for encontrada.;9001;Equipes de qualidade. Coloque pessoas chave juntas para resolver problemas de qualidade em sua ÃƒÂ¡rea. Coloque a pessoa que identificou o problema no comando do grupo, e recompense essa pessoa para o esforÃƒÂ§o extra e quando a soluÃƒÂ§ÃƒÂ£o que for encontrada.;;;;;;ACT;1;1
LearningActivity;9142;pt_BR;Controle de progresso. Quebre as tarefas delegadas em blocos com prazos e metas distintas. Use esses esta estratégia para ajustar responsabilidades e recursos, conforme necessário, garantir o progresso e manter a confiança do empregado em seu trabalho.;9001;Controle de progresso. Quebre as tarefas delegadas em blocos com prazos e metas distintas. Use esses esta estratÃƒÂ©gia para ajustar responsabilidades e recursos, conforme necessÃƒÂ¡rio, garantir o progresso e manter a confianÃƒÂ§a do empregado em seu trabalho.;;;;;;ACT;1;1
LearningActivity;9235;pt_BR;Vá direto ao ponto principal. Os leitores têm apenas alguns minutos ou menos para ler qualquer e-mail, coloque as maiores ideias na frente.;9001;VÃƒÂ¡ direto ao ponto principal. Os leitores tÃƒÂªm apenas alguns minutos ou menos para ler qualquer e-mail, coloque as maiores ideias na frente.;;;;;;ACT;1;1
LearningActivity;9099;pt_BR;Saia na frente. De onde vem as novas ideias na sua organização? Pode ser de vendas e marketing, pois estão próximos dos clientes, desde o desenvolvimento do produto, até  os clientes. Saia e receba formações sobre o que está acontecendo na linha de frente, e pense em como ajudar a organização a viver de acordo com esta nova visão.;9001;Saia na frente. De onde vem as novas ideias na sua organizaÃƒÂ§ÃƒÂ£o? Pode ser de vendas e marketing, pois estÃƒÂ£o prÃƒÂ³ximos dos clientes, desde o desenvolvimento do produto, atÃƒÂ©  os clientes. Saia e receba formaÃƒÂ§ÃƒÂµes sobre o que estÃƒÂ¡ acontecendo na linha de frente, e pense em como ajudar a organizaÃƒÂ§ÃƒÂ£o a viver de acordo com esta nova visÃƒÂ£o.;;;;;;ACT;1;1
LearningActivity;9281;pt_BR;Ajuste você mesmo. Lide com problemas de qualidade quando você tiver a chance, ou, pelo menos, assuma a responsabilidade de ver quem pode resolve-lo. Ao cuidar de problemas comuns de qualidade, você pode obter uma melhor compreensão da causa raiz e chegar a soluções permanentes.;9001;Assuma a responsabilidade. VocÃƒÂª ÃƒÂ© responsÃƒÂ¡vel pelo seu prÃƒÂ³prio desenvolvimento. Agende reuniÃƒÂµes regulares com seu supervisor para falar do seu desenvolvimento pessoal. Prepare-se para estes encontros atravÃƒÂ©s da criaÃƒÂ§ÃƒÂ£o de um plano de desenvolvimento.;;;;;;ACT;1;1
LearningActivity;9185;pt_BR;Incentive a criação de confiança. Quando alguém da uma opinião ou ideia, reconheça o esforço, mesmo se você não concordar. Quando você responder, foque em questões específicas.;9001;Incentive a criaÃƒÂ§ÃƒÂ£o de confianÃƒÂ§a. Quando alguÃƒÂ©m da uma opiniÃƒÂ£o ou ideia, reconheÃƒÂ§a o esforÃƒÂ§o, mesmo se vocÃƒÂª nÃƒÂ£o concordar. Quando vocÃƒÂª responder, foque em questÃƒÂµes especÃƒÂ­ficas.;;;;;;ACT;1;1
LearningActivity;9187;pt_BR;Crie um ambiente favorável a troca aberta de ideias. Ofereça treinamento para os indivíduos que são insensíveis ao criticar as opiniões dos outros. Mostre como facilitar a discussão em torno de pontos de acordo e desacordo.;9001;Crie um ambiente favorÃƒÂ¡vel a troca aberta de ideias. OfereÃƒÂ§a treinamento para os indivÃƒÂ­duos que sÃƒÂ£o insensÃƒÂ­veis ao criticar as opiniÃƒÂµes dos outros. Mostre como facilitar a discussÃƒÂ£o em torno de pontos de acordo e desacordo.;;;;;;ACT;1;1
LearningActivity;9144;pt_BR;Analise as tendências históricas da indústria. Onde a indústria começou, como tem evoluído, quem têm sido os principais participantes, quem foram os grandes sucessos, e que o que falhou?;9001;Analise as tendÃƒÂªncias histÃƒÂ³ricas da indÃƒÂºstria. Onde a indÃƒÂºstria comeÃƒÂ§ou, como tem evoluÃƒÂ­do, quem tÃƒÂªm sido os principais participantes, quem foram os grandes sucessos, e que o que falhou?;;;;;;ACT;1;1
LearningActivity;9135;pt_BR;Planeje com antecedência. Não demore para contar a sua equipe sobre uma mudança. Diga-lhes de imediato, mas seja flexível. Responda as perguntas ou preocupações que possam ter e, retome seus planos. Antes de iniciar uma mudança, antecipe os obstáculos de implementação e o plano para ultrapassar essas barreiras.;9001;Planeje com antecedÃƒÂªncia. NÃƒÂ£o demore para contar a sua equipe sobre uma mudanÃƒÂ§a. Diga-lhes de imediato, mas seja flexÃƒÂ­vel. Responda as perguntas ou preocupaÃƒÂ§ÃƒÂµes que possam ter e, retome seus planos. Antes de iniciar uma mudanÃƒÂ§a, antecipe os obstÃƒÂ¡culos de implementaÃƒÂ§ÃƒÂ£o e o plano para ultrapassar essas barreiras.;;;;;;ACT;1;1
LearningActivity;9219;pt_BR;"Seja objetivo. Abstenha-se de ataques pessoais, e mantenha a crÃƒÂ­tica focada em incidentes ou padrÃƒÂµes de comportamentos especÃƒÂ­ficos. Use ""Nesta situaÃƒÂ§ÃƒÂ£o, vocÃƒÂª ..."" em vez de ""vocÃƒÂª sempre ..."" nÃƒÂ£o generalize.";9001;"Seja objetivo. Abstenha-se de ataques pessoais, e mantenha a crÃƒÂ­tica focada em incidentes ou padrÃƒÂµes de comportamentos especÃƒÂ­ficos. Use ""Nesta situaÃƒÂ§ÃƒÂ£o, vocÃƒÂª ..."" em vez de ""vocÃƒÂª sempre ..."" nÃƒÂ£o generalize.";;;;;;ACT;1;1
LearningActivity;9049;pt_BR;"Controle das reaÃƒÂ§ÃƒÂµes (para palestras ou treinamentos). Aprenda a lidar com questÃƒÂµes interpessoais e emocionais, bem como questÃƒÂµes tÃƒÂ©cnicas. a) ConheÃƒÂ§a cada cliente como uma pessoa. Aproveite todas as oportunidades para estabelecer conexÃƒÂµes com pessoas na plateia. Para definir um tom amigÃƒÂ¡vel antes da apresentaÃƒÂ§ÃƒÂ£o, apresente-se a quem vocÃƒÂª nÃƒÂ£o conhece, e passe alguns minutos com cada cliente-chave em uma conversa casual. Pergunte-lhes sobre os interesses pessoais, hobbies, etc., e escreva o que vocÃƒÂª aprendeu em seus registros de clientes. b) Olhe para o dia do cliente. ReconheÃƒÂ§a o esforÃƒÂ§o que o cliente estÃƒÂ¡ lidando neste dia e mostre empatia. Por exemplo, se o cliente atrasou, adapte-se conforme necessÃƒÂ¡rio: ""Eu posso ver que vocÃƒÂª tem um monte de pratos para equilibrar hoje. Talvez o que podemos fazer ÃƒÂ© equilibrar alguns hoje, e entÃƒÂ£o, eu volto na prÃƒÂ³xima semana para ajudÃƒÂ¡-lo com os outros."" C) reconheÃƒÂ§a ÃƒÂ s emoÃƒÂ§ÃƒÂµes negativas . Se vocÃƒÂª sentir raiva ou frustraÃƒÂ§ÃƒÂ£o, suavize a situaÃƒÂ§ÃƒÂ£o e tente resolver a causa. Se ÃƒÂ© algo que vocÃƒÂª disse ou fez, peÃƒÂ§a desculpas, faÃƒÂ§a perguntas para entender as questÃƒÂµes completamente, e em seguida, passe de uma forma mais positiva.";9001;"Controle das reaÃƒÂ§ÃƒÂµes (para palestras ou treinamentos). Aprenda a lidar com questÃƒÂµes interpessoais e emocionais, bem como questÃƒÂµes tÃƒÂ©cnicas. a) ConheÃƒÂ§a cada cliente como uma pessoa. Aproveite todas as oportunidades para estabelecer conexÃƒÂµes com pessoas na plateia. Para definir um tom amigÃƒÂ¡vel antes da apresentaÃƒÂ§ÃƒÂ£o, apresente-se a quem vocÃƒÂª nÃƒÂ£o conhece, e passe alguns minutos com cada cliente-chave em uma conversa casual. Pergunte-lhes sobre os interesses pessoais, hobbies, etc., e escreva o que vocÃƒÂª aprendeu em seus registros de clientes. b) Olhe para o dia do cliente. ReconheÃƒÂ§a o esforÃƒÂ§o que o cliente estÃƒÂ¡ lidando neste dia e mostre empatia. Por exemplo, se o cliente atrasou, adapte-se conforme necessÃƒÂ¡rio: ""Eu posso ver que vocÃƒÂª tem um monte de pratos para equilibrar hoje. Talvez o que podemos fazer ÃƒÂ© equilibrar alguns hoje, e entÃƒÂ£o, eu volto na prÃƒÂ³xima semana para ajudÃƒÂ¡-lo com os outros."" C) reconheÃƒÂ§a ÃƒÂ s emoÃƒÂ§ÃƒÂµes negativas . Se vocÃƒÂª sentir raiva ou frustraÃƒÂ§ÃƒÂ£o, suavize a situaÃƒÂ§ÃƒÂ£o e tente resolver a causa. Se ÃƒÂ© algo que vocÃƒÂª disse ou fez, peÃƒÂ§a desculpas, faÃƒÂ§a perguntas para entender as questÃƒÂµes completamente, e em seguida, passe de uma forma mais positiva.";;;;;;ACT;1;1
LearningActivity;9007;pt_BR;Consulta das partes interessadas. Permita a entrada de pessoas que irÃƒÂ£o ajudar a implementar uma decisÃƒÂ£o. NÃƒÂ£o aceite relatÃƒÂ³rios de segunda mÃƒÂ£o. VÃƒÂ¡ direto ÃƒÂ  fonte.;9001;Consulta das partes interessadas. Permita a entrada de pessoas que irÃƒÂ£o ajudar a implementar uma decisÃƒÂ£o. NÃƒÂ£o aceite relatÃƒÂ³rios de segunda mÃƒÂ£o. VÃƒÂ¡ direto ÃƒÂ  fonte.;;;;;;ACT;1;1
LearningActivity;9180;pt_BR;Defina expectativas para o trabalho em equipe. Deixe claro que a cooperaÃƒÂ§ÃƒÂ£o ÃƒÂ© vital para o sucesso de todos e que vocÃƒÂª espera que cada pessoa a haja de forma adequada.;9001;Defina expectativas para o trabalho em equipe. Deixe claro que a cooperaÃƒÂ§ÃƒÂ£o ÃƒÂ© vital para o sucesso de todos e que vocÃƒÂª espera que cada pessoa a haja de forma adequada.;;;;;;ACT;1;1
